retrieval_id,aio_sources_id,source_url,source_title,source_text,source_name,source_rank,rank,root_domain
fd59c614-4830-47ec-901f-3af2fd7c068e,52b02a6b-f296-4968-abe7-b3aae440f7a9,"https://www.reddit.com/r/Littleton/comments/1nig75t/any_partsneighborhoods_unsafe/#:~:text=We%20live%20few%20blocks%20west,green%20space%20and%20nice%20neighbors.&text=South%20Park%20neighborhood%20off%20of,great%20and%20feeds%20into%20Heritage.",Any parts/neighborhoods unsafe? : r/Littleton - Reddit,"Sep 15, 2025 — We live few blocks west of Broadway, near ridge rd. Broadway is a busy road. I suppose you could see some trouble happ...",Reddit,9,9,www.reddit.com
7822dc40-530f-4a24-b134-2121bd1a5096,09a630af-e2d6-412b-b017-55f1cda368b9,https://indicators.sbcounty.gov/safety/crime-rate/,Crime Rate - San Bernardino County Community Indicators,Home ›Safety › Crime Rate NUMBER OF HOMICIDES DROPS BY MORE THAN HALF Crime impacts both real and perceived safety. It can also ne...,San Bernardino County Community Indicators (.gov),1,1,indicators.sbcounty.gov
7822dc40-530f-4a24-b134-2121bd1a5096,f45f1c85-da9d-43d5-aeeb-5d5e243f62ee,"https://www.vvdailypress.com/story/news/crime/2025/08/16/crime-rate-spikes-in-san-bernardino-county-as-state-reports-overall-decrease/85695726007/#:~:text=San%20Bernardino%20County%20sees%20increase,Rape%20spiked%20by%2032%25.",Is crime rising in San Bernardino County? What the latest data shows,"Aug 16, 2025 — San Bernardino County sees increase in violent, property crimes. San Bernardino County bucked the statewide trend, wit...",Victorville Daily Press,2,2,www.vvdailypress.com
7822dc40-530f-4a24-b134-2121bd1a5096,03c74b39-e1a6-40b6-b168-745b854099dd,"https://www.thecentersquare.com/california/san-bernardino-ca-reported-one-of-the-highest-murder-rates-in-the-us/article_3e8bbb4c-225c-55bf-a7fa-90c7e604a955.html#:~:text=The%20Centers%20for%20Disease%20Control,were%20not%20excluded%20from%20analysis.&text=Washington%2C%20D.C.","San Bernardino, CA Reported One of the Highest Murder Rates in ...","Nov 22, 2021 — Table_title: San Bernardino, CA Reported One of the Highest Murder Rates in the US Table_content: header: | Rank | Cit...",The Center Square,3,3,www.thecentersquare.com
99836dd0-2541-4954-9609-59cd25226a0b,84fa42b2-07a1-4ee4-be98-1a65aaf8131a,"https://lasallecounty.com/copy-requests#:~:text=or%20e%2Dmail%20to:%20CriminalCopies,to:%20LaSalle%20County%20Circuit%20Clerk.&text=you%20have%20questions-,NOTE:%20Under%20normal%20operating%20schedules%20our%20typical%20turn%20around%20time,up%20to%205%20business%20days.",Copy Requests - LaSalle County Circuit Clerk,or e-mail to: CriminalCopies@lasallecounty.com The requester will be responsible for statutory fees (See Section 27.1a of the Cler...,LaSalle County Circuit Clerk,1,1,lasallecounty.com
99836dd0-2541-4954-9609-59cd25226a0b,fa2a12c0-c776-47b5-a299-924339578e48,"https://lasallecounty.com/online-court-records-3#:~:text=View%20Court%20Case%20Information,Ex.",Online Court Records - LaSalle County Circuit Clerk,View Court Case Information. Court case information can be viewed on this website. You may search for specific case information us...,LaSalle County Circuit Clerk,2,2,lasallecounty.com
99836dd0-2541-4954-9609-59cd25226a0b,564fd660-c296-4eee-a885-81c9637bc38c,"https://lasallecounty.com/#:~:text=Welcome%20to%20LaSalle%20County,the%20north%20side%20of%20Ottawa.",LaSalle County Circuit Clerk,Welcome to LaSalle County. Circuit Clerk Greg Vaccaro. welcome to LaSalle County Circuit Clerk Greg Vacarro Website. Our Civil Div...,LaSalle County Circuit Clerk,3,3,lasallecounty.com
99836dd0-2541-4954-9609-59cd25226a0b,31f11f3a-018f-4a2a-9d86-93b75e2178d6,"https://isp.illinois.gov/BureauOfIdentification/MyRecord#:~:text=Any%20individual%20may%20approach%20any,Illinois'%20Access%20and%20Review%20process.",What's on My Record - Illinois State Police,Any individual may approach any Illinois law enforcement or correctional facility or licensed fingerprint vendor agency during reg...,Illinois State Police (.gov),4,4,isp.illinois.gov
99836dd0-2541-4954-9609-59cd25226a0b,60726a50-93e3-49de-bbf5-0b89c1e02916,"https://www.illinoislegalaid.org/legal-information/how-get-copies-your-court-records#:~:text=How%20do%20I%20find%20a,by%20name%20or%20case%20number.",How to access your court records | Illinois Legal Aid Online,"May 4, 2023 — How do I find a court record in person? Ask the Circuit Clerk for copies of your court dispositions or use the public c...",Illinois Legal Aid Online,5,5,www.illinoislegalaid.org
99836dd0-2541-4954-9609-59cd25226a0b,3683a95f-816a-477a-bafd-e64b3a9ecab3,"https://researchil.tylerhost.net/#:~:text=re:SearchIL%20is%20an%20easy,and%20documents%20throughout%20the%20state.",re:SearchIL,"re:SearchIL is an easy-to-use site that provides secure, cross-jurisdictional access to electronic court records and documents thr...",researchil.tylerhost.net,6,6,researchil.tylerhost.net
99836dd0-2541-4954-9609-59cd25226a0b,98dc9f90-7548-40db-a53f-6affe9fa86f7,"https://www.lasallecountyil.gov/511/Records-Online#:~:text=Online%20Record%20Searching,records%20on%20a%20regular%20basis.","Records Online | LaSalle County, IL",Online Record Searching. There are three ways to search for records online. Laredo and Tapestry each provide actual document image...,"LaSalle County, IL (.gov)",7,7,www.lasallecountyil.gov
99836dd0-2541-4954-9609-59cd25226a0b,43ea7b72-d4f1-44db-a058-e9853e226bd0,"https://ottawacountyclerkofcourts.com/records.php#:~:text=The%20Ottawa%20County%20Clerk%20of%20Courts%20website,responsible%20for%20any%20use%20of%20the%20information.",Public Records,The Ottawa County Clerk of Courts website has a search tool that allows you to find an individual record by name or case number. T...,Ottawa County Clerk of Courts,8,8,ottawacountyclerkofcourts.com
99836dd0-2541-4954-9609-59cd25226a0b,c28b5ca7-f94a-4cec-8086-86c6069204ff,https://www.judici.com/#:~:text=Login:%20*%20Multicourt.%20*%20Courtlook.%20*%20Court%20Reports.,Judici Welcome Page,"Nov 9, 2025 — Login: * Multicourt. * Courtlook. * Court Reports.",Judici Welcome Page,9,9,www.judici.com
99836dd0-2541-4954-9609-59cd25226a0b,d9710f8a-71fd-425b-af41-0cee9be0c47b,"https://www.illinoiscourts.gov/News/1537/Supreme-Court-approves-free-remote-public-access-to-reviewing-court-documents-effective-May-1-2025/news-detail/#:~:text=the%20Illinois%20Courts-,Supreme%20Court%20approves%20free%20remote%20public%20access%20to,documents%20effective%20May%201%2C%202025&text=The%20Illinois%20Supreme%20Court%20entered,and%20the%20five%20appellate%20courts.",Supreme Court approves free remote public access to reviewing court ...,"Apr 29, 2025 — Supreme Court approves free remote public access to reviewing court documents effective May 1, 2025. The Illinois Supr...",Illinois Courts (.gov),10,10,www.illinoiscourts.gov
99836dd0-2541-4954-9609-59cd25226a0b,6e75b1a7-83e6-4e31-8d0a-6ea217e858bd,https://www.youtube.com/watch?v=WZ16c7m6-c8&t=29,How Can I Access Illinois Court Records Online ...,"Oct 2, 2024 — this service service allows you to determine the general status of historical. and active court cases the case data ava...",YouTube,11,11,www.youtube.com
99836dd0-2541-4954-9609-59cd25226a0b,e0d772d8-19ed-48d5-a4a2-b59a422d3363,"https://www.ottawacountymunicipalcourt.com/search.php#:~:text=To%20get%20verified%20information%20about%20Ottawa%20County,least%20twenty%2Dfour%20hours%2C%20and%20may%20be%20longer.",Ottawa County Municipal Court - Record Search,"To get verified information about Ottawa County Municipal Court records, you can: * Send a request to the court * Visit the court ...",www.ottawacountymunicipalcourt.com,12,12,www.ottawacountymunicipalcourt.com
99836dd0-2541-4954-9609-59cd25226a0b,dbb19559-34d3-4ee6-a4de-9b8744545481,"https://berwynpd.org/submit-a-background-request/#:~:text=To%20request%20the%20transcript%2C%20you%20must:%20*,the%20county%20where%20the%20case%20was%20heard",Request Background \u0026 Records Information - Berwyn Police Department,"To request the transcript, you must: * The Illinois State Police will mail a criminal history transcript to your address You can e...",Berwyn Police Department,13,13,berwynpd.org
99836dd0-2541-4954-9609-59cd25226a0b,48fdfdc8-5bc1-4e26-a165-3d74f05fe174,"https://illinoiscourtrecords.us/adams/#:~:text=Furthermore%2C%20the%20UCIA%20permits%20the%20dissemination%20of,Checks%20from%20the%20ISP%20Bureau%20of%20Identification.",Adams County Court Records | IllinoisCourtRecords.us,"Furthermore, the UCIA permits the dissemination of conviction records preserved by the Bureau of Identification to the public. Hen...",IllinoisCourtRecords.us,14,14,illinoiscourtrecords.us
e6f0ba0a-83ea-43fe-abd7-82c4dc953968,10e38661-db9b-4ae4-9813-aa339c139585,"https://www.exploresparta.com/#:~:text=Sparta%20is%20less%20than%2090,%2C%20restaurants%2C%20festivals%20and%20more.","Sparta, TN: Explore Sparta... The Playground of Tennessee!","Sparta is less than 90 minutes from Nashville, Knoxville, or Chattanooga and is known as both “The Land of Falling Water” and “Blu...",www.exploresparta.com,1,1,www.exploresparta.com
e6f0ba0a-83ea-43fe-abd7-82c4dc953968,65fa2c41-1c13-4631-a4ff-d2a8875b3b21,"https://en.wikipedia.org/wiki/Sparta,_Tennessee#:~:text=Sparta%20was%20established%20in%201809,Hawthorne%20C.","Sparta, Tennessee - Wikipedia","Sparta was established in 1809 as a county seat for White County, which had been created in 1806. The city was named after the anc...",Wikipedia,2,2,en.wikipedia.org
e6f0ba0a-83ea-43fe-abd7-82c4dc953968,8a5e8ec9-7d8f-4572-8df9-5f8ea912aa36,"https://www.tripadvisor.com/Attractions-g55351-Activities-Sparta_Tennessee.html#:~:text=1.,By%20robbs869",THE 15 BEST Things to Do in Sparta (2025) - Tripadvisor,1. Burgess Falls State Park. 4.7. (518) Nature & Wildlife Areas. This park contains 4 breathtaking waterfalls as well as fishing a...,Tripadvisor,3,3,www.tripadvisor.com
e6f0ba0a-83ea-43fe-abd7-82c4dc953968,09e38403-d64f-43f4-bc71-c991733aa7b9,"https://www.spartatn.gov/history#:~:text=Goodspeed%2C%20Nashville%20and%20Chicago%2C%201887,American%20Bluegrass%20style%20of%20music.","Sparta, TN History, Heritage","Goodspeed, Nashville and Chicago, 1887.) ""Sparta, the county seat and principal town and commercial point of White County, is situ...",City of Sparta (TN) (.gov),4,4,www.spartatn.gov
e6f0ba0a-83ea-43fe-abd7-82c4dc953968,99ee3fa6-98ed-47e9-832c-af30f31f8fe8,"https://www.spartatn.gov/#:~:text=Come%20see%20rural%20life%20at,fans%20and%20nature%20lovers%20alike.","Sparta, Tennessee | Welcome to the Official Website of Sparta ...","Come see rural life at its finest amid the gorgeous, rolling hills of White County and Sparta, TN. From rambling farms that hearke...",City of Sparta (TN) (.gov),5,5,www.spartatn.gov
e6f0ba0a-83ea-43fe-abd7-82c4dc953968,8bec556a-493a-4ae9-8586-7b92fc3f2d66,"https://www.spartatn.gov/welcome#:~:text=We%20are%20proud%20of%20our,call%20it%20%2D%2D%20Bluegrass%2C%20U.S.A.","Sparta, TN Government | Sparta, Tennessee","We are proud of our community, from the beautiful nature to our award-winning hospital, friendly people, low housing cost and prox...",City of Sparta (TN) (.gov),6,6,www.spartatn.gov
e6f0ba0a-83ea-43fe-abd7-82c4dc953968,8dec0534-243d-4836-bc96-0b226431d53b,"https://www.tripadvisor.com/Tourism-g55351-Sparta_Tennessee-Vacations.html#:~:text=What%20is%20Sparta%20known%20for,Calfkiller%20Brewing%20Company","Sparta, TN: All You Must Know Before You Go (2025) - Tripadvisor","What is Sparta known for? Sparta is known for some of its popular attractions, which include: Burgess Falls State Park. Virgin Fal...",Tripadvisor,7,7,www.tripadvisor.com
e6f0ba0a-83ea-43fe-abd7-82c4dc953968,7b1f3948-55af-486b-96e7-89752344f2cf,"https://www.spartatn.gov/nature#:~:text=Our%20Sights%20%E2%80%BA%20Nature%20%E2%80%BA-,Nature,see%20the%20treetops%20in%20Kentucky.","Sparta, TN Rivers, Lakes, Waterfalls | Sparta, Tennessee","Nature. If the great outdoors is your muse, you will find an abundance of natural and man-made beauty in Sparta and White County, ...",City of Sparta (TN) (.gov),8,8,www.spartatn.gov
e6f0ba0a-83ea-43fe-abd7-82c4dc953968,3751ce76-24d5-4446-a7e8-65c60f5224b7,"https://thehowardgrouptn.com/neighborhoods/sparta#:~:text=Sparta%20also%20has:%20*%20Quaint%20downtown%20and,also%20close%20to%20Nashville%2C%20Knoxville%2C%20and%20Chattanooga.",Sparta | Neighborhood Guide,"Sparta also has: * Quaint downtown and antique shops * Active, helpful Chamber of Commerce * Award-winning hospital and quality me...",thehowardgrouptn.com,9,9,thehowardgrouptn.com
599d4241-5d2d-4a2a-a212-606a6ff41dd9,4bbcc134-7efc-4c9d-a427-50d392fd4f41,"https://www.houstonchronicle.com/news/houston-texas/article/houston-metro-bus-guide-20186829.php#:~:text=website%20or%20app.-,How%20much%20does%20the%20bus%20cost?,within%20a%20three%2Dhour%20window.","Houston's Metro bus system guide: Fares, routes, schedules and more","Feb 24, 2025 — How much does the bus cost? The standard fare for a local bus ride is $1.25. Discounted fares for 60 cents are availab...",Houston Chronicle,1,1,www.houstonchronicle.com
599d4241-5d2d-4a2a-a212-606a6ff41dd9,72dda312-acb1-4280-a898-a9551343db95,"https://www.ridemetro.org/riding-metro/transit-services/local-bus#:~:text=Pass%20Learn%20more-,METRO%20Day%20Pass,2%20a.m.%20the%20following%20morning.",METRO Local Bus Service | ADA Accessible Public Transit | Houston ...,METRO Day Pass A contactless fare payment option – this offers the best value if you ride local services three or more times in a ...,www.ridemetro.org,2,2,www.ridemetro.org
599d4241-5d2d-4a2a-a212-606a6ff41dd9,88304dd5-e10d-4cee-bc60-1e2d02b70c6a,"https://www.ridemetro.org/riding-metro/houston-attractions/william-p-hobby-airport#:~:text=Table_title:%20Fares%20Table_content:%20header:%20%7C%20Service%20%7C,Discounted%20Fare*:%2060%20cents%20to%20board%20%7C",Ride METRO to and from William P. Hobby Airport - Houston,Table_title: Fares Table_content: header: | Service | Regular Fare | Discounted Fare* | row: | Service: Local Bus | Regular Fare: ...,www.ridemetro.org,3,3,www.ridemetro.org
599d4241-5d2d-4a2a-a212-606a6ff41dd9,ce30d085-da4c-4692-b783-7ddf82181d1f,"https://www.ridemetro.org/fares/policies-procedures#:~:text=For%20most%20METRO%20transit%20services,how%20to%20pay%20fare%20citations.",Fare Policies and Procedures - Houston - METRO,"Feb 14, 2025 — For most METRO transit services, the regular fare to board is $1.25 and the discounted fare is 60 cents. For Park & Ri...",www.ridemetro.org,4,4,www.ridemetro.org
599d4241-5d2d-4a2a-a212-606a6ff41dd9,098c8e4a-0328-478a-9576-4eadf2af0362,https://www.ridemetro.org/fares/all-about-fares,Fares | Ways to Pay | METRO Bus and Rail Transit | Houston ...,There are more than 200 retailers across the Houston region where you can obtain or reload a METRO Q® Fare Card or METRO Day Pass.,www.ridemetro.org,5,5,www.ridemetro.org
599d4241-5d2d-4a2a-a212-606a6ff41dd9,82fe6400-4460-4fe0-a721-5f3acdc998b9,https://www.visithoustontexas.com/travel-planning/getting-to-and-around-houston/getting-around-houston/,Getting Around Houston | Houston Transportation Options,"METRO offers several types of bus service in Houston. * Local service runs mostly on city streets, stopping at every other corner ...",Visit Houston Texas,6,6,www.visithoustontexas.com
599d4241-5d2d-4a2a-a212-606a6ff41dd9,45ff98b3-b63e-452c-be28-480eb7d13572,"https://www.tripsavvy.com/houston-public-transportation-guide-4178311#:~:text=Fares:%20Rides%20on%20local%20buses,have%20an%20adult%20with%20them.",Getting Around Houston: Guide to Public Transportation,"Oct 27, 2020 — Fares: Rides on local buses are $1.25, with free transfers up to three hours in either direction if you pay using one ...",TripSavvy,7,7,www.tripsavvy.com
599d4241-5d2d-4a2a-a212-606a6ff41dd9,bb8c7468-4c5a-402b-a35f-24f9e52c9e18,"https://www.ridemetro.org/riding-metro/transit-services/park-and-ride-bus/route-details/204-spring#:~:text=How%20much%20does%20it%20cost,and%20up%20to%20one%20assistant",204 Spring Park & Ride bus - Houston - METRO,How much does it cost to ride a Park & Ride bus? The regular fare to board ranges from $2-4.50. So a round-trip can cost $4-$9. Th...,www.ridemetro.org,8,8,www.ridemetro.org
599d4241-5d2d-4a2a-a212-606a6ff41dd9,ee032537-d315-4e0f-80f0-185200246ce1,"https://www.reddit.com/r/houston/comments/1n91un5/houstonarea_public_transit_agencies_to_offer_free/#:~:text=They%20keep%20ignoring%20it%2C%20but,also%20currently%20do%20not%20do).",Houston-area public transit agencies to offer 'Free Fare ...,"Sep 4, 2025 — They keep ignoring it, but the majority of locals would rather have better service. $1.25 is stupid cheap as it is comp...",Reddit,9,9,www.reddit.com
599d4241-5d2d-4a2a-a212-606a6ff41dd9,9adbc957-16b1-4ba9-a571-7ed6010b6d53,"https://www.reddit.com/r/houston/comments/1h0dc8q/what_is_the_most_cost_effective_way_to_use_the/#:~:text=Comments%20Section,Westchase%2C%20and%20Mission%20Bend%20P&Rs.",What is the most cost effective way to use the metro : r/houston,"Nov 25, 2024 — Comments Section. itsfairadvantage. • 1y ago. Use the Q app . The only real deal is 5 free passes for every 50 fares. ...",Reddit,10,10,www.reddit.com
599d4241-5d2d-4a2a-a212-606a6ff41dd9,6ac093c0-d315-4864-82c0-17088d8305eb,"https://www.ridemetro.org/riding-metro/transit-services/park-and-ride-bus/route-details/257-townsen#:~:text=The%20Townsen%20Park%20&%20Ride%20bus%20route,**Route%20map**%20*%20**Next%20bus%20arrival%20times**","257 Townsen | METRO Park & Ride Bus | Houston, Texas",The Townsen Park & Ride bus route runs every 15 minutes Monday through Friday and no service on weekends. The route includes: * **,www.ridemetro.org,11,11,www.ridemetro.org
599d4241-5d2d-4a2a-a212-606a6ff41dd9,48d89228-b9fd-47f1-9418-47bb867458ee,"https://downtownhouston.org/navigate/metro-bus-and-rail#:~:text=METRO%20Services,Park%E2%80%94all%20for%20just%20$1.25.",Transit | Navigate - Downtown Houston,"METRO Services. METRO's expansive public transit network includes 108 bus routes with nearly 9,000 stops, along with 22.9 miles of...",Downtown Houston,12,12,downtownhouston.org
599d4241-5d2d-4a2a-a212-606a6ff41dd9,5a0306a3-38e8-46e6-8cd8-2c41492e69f2,"https://www.ridemetro.org/riding-metro/transit-services/welcome-aboard#:~:text=For%20transfers%20to%20Park%20&%20Ride,Pass%20on%20Park%20&%20Ride%20service.","Learn How to Ride METRO Public Transit | Bus | Rail | Houston, Texas","For transfers to Park \u0026 Ride bus service using a METRO Q® Fare Card, you'll only pay the fare difference for up to three hours in ...",www.ridemetro.org,13,13,www.ridemetro.org
e804b866-b328-4543-a57d-ae83bad76331,eb9ab387-af22-4494-9ed9-48b06fc07faf,"https://www.co.trumbull.oh.us/senior-levy/sl_transportation.html#:~:text=Transportation%20for%20Trumbull%20County%20Residents,trip%20per%20week%20per%20consumer.&text=INSTRUCTIONS%20FOR%20FILLING%20OUT%20TRANSPORTATION,application%20will%20not%20be%20approved.","Senior Transportation... - Trumbull County, Ohio",Transportation for Trumbull County Residents aged 60 and over is available through Trumbull County Senior Levy funding as well as ...,Trumbull County,1,1,www.co.trumbull.oh.us
e804b866-b328-4543-a57d-ae83bad76331,2257752d-acae-4975-b7a4-be8eae497ece,"https://www.wrtaonline.com/fares-and-passes/#:~:text=(UPDATE!),via%20the%20EZfare%20smartphone%20app.",Fares & Passes - Western Reserve Transit Authority: WRTA,"(UPDATE!) Rides on all WRTA buses are FREE. Sales of Adult Day Passes, Multi-Ride Tickets and Adult 31-Day Passes have been suspen...",Western Reserve Transit Authority: WRTA,2,2,www.wrtaonline.com
e804b866-b328-4543-a57d-ae83bad76331,40dc4d54-9856-4da1-8318-aececd1a4f86,"https://www.co.trumbull.oh.us/transportation/transit_fares.html#:~:text=Senior%20and%20disabled%20in%20county,$2.00",On Demand Fares - Trumbull County Transit,Senior and disabled in county for medical ...... $2.00. Senior and disabled in county for non-medical up to 12 miles ...... $2.00.,Trumbull County,3,3,www.co.trumbull.oh.us
e804b866-b328-4543-a57d-ae83bad76331,5ad0437c-e38f-4e14-a6cd-5ed4db946a55,"https://m.facebook.com/EdJMarkey/photos/the-wrta-just-extended-fare-free-buses-through-june-2026-making-it-the-longest-r/1306852620799508/#:~:text=Photos-,The%20WRTA%20just%20extended%20fare%2Dfree%20buses%20through%20June%202026,Let's%20keep%20leading%20the%20way.&text=Not%20free%2C%20it's%20taxpayer%20funded.",Senator - The WRTA just extended fare-free buses through June 2026 ...,"Apr 28, 2025 — The WRTA just extended fare-free buses through June 2026, making it the longest-running fare-free regional transit sys...",Facebook,4,4,m.facebook.com
252f7c8a-668b-4545-bb54-3d1e931f492e,ff027f09-8a95-4c6c-bfce-cb66c6b538e8,"https://www.eventective.com/olympia-wa/wedding-venues/#:~:text=The%20Five2Five%20Wedding%20&%20Event%20Venue,landscapes%20and%20vibrant%20floral%20beauty.","Wedding Venues in Olympia, WA - Eventective","The Five2Five Wedding & Event Venue. 1. Serving the Olympia, WA Area. 152 Capacity. $6,800 to $15,000 / Wedding. Nestled in the pi...",Eventective,1,1,www.eventective.com
252f7c8a-668b-4545-bb54-3d1e931f492e,52b581ba-9b5c-4579-8f5c-3cf8ea50778d,"https://www.theknot.com/marketplace/wedding-reception-venues-olympia-wa#:~:text=Olympia%2C%20WA-,113%20Wedding%20Venues%20in%20Olympia%2C%20WA,0%2D50%20Guests","Wedding Venues With Prices in Olympia, WA - The Knot","113 Wedding Venues in Olympia, WA. Filters. Showing Image number 1 out of 10. Olympia, WA. 4.5(15) Indian Summer Golf & Country Cl...",The Knot,2,2,www.theknot.com
252f7c8a-668b-4545-bb54-3d1e931f492e,c75ef58f-3680-4fee-bcf3-f939e54e85de,"https://wedding.report/index.cfm/action/wedding_cost.estimate/budgetid/0E9FABD0-1543-4CB0-98A91B0AAD80DABC#:~:text=The%20type%20of%20wedding%20is,typically%20between%20$30%2C963%20and%20$37%2C843.&text=$23%20and%20$28-,What%20is%20the%20average%20wedding%20cost%20in%20Olympia%20WA?,typically%20between%20$23%20and%20$28.&text=$35%2C457%20and%20$43%2C337-,What%20is%20the%20average%20wedding%20cost%20in%20Olympia%20WA?,typically%20between%20$35%2C457%20and%20$43%2C337.&text=$4%2C817%20and%20$5%2C887-,What%20is%20the%20average%20wedding%20cost%20in%20Olympia%20WA?,typically%20between%20$4%2C817%20and%20$5%2C887.&text=$4%2C817%20and%20$5%2C887-,What%20is%20the%20average%20wedding%20cost%20in%20Olympia%20WA?,typically%20between%20$4%2C817%20and%20$5%2C887.",2023 Olympia WA Average Wedding Cost Estimate,"The type of wedding is Formal, Romantic, Rustic and the wedding color theme is Greens. The estimated cost for this type of wedding...",The Wedding Report,3,3,wedding.report
252f7c8a-668b-4545-bb54-3d1e931f492e,5e8f0cb1-96a8-4ede-95ec-51cabd5f16b1,"https://wedding.report/index.cfm/action/wedding_cost.estimate/budgetid/3A9518C7-D001-0BCA-929D874F7D71E157#:~:text=Wedding%20Cost%20Breakdown,wedding%20party%20is%20$365%20%2D%20$447.",Wedding Cost Estimate for 2026 in Olympia WA,Wedding Cost Breakdown. What is the average cost of a wedding for 38 guests in Olympia WA? For a wedding with 38 guests in the Oly...,The Wedding Report,4,4,wedding.report
252f7c8a-668b-4545-bb54-3d1e931f492e,f0c8653b-c0a8-4334-8ff2-985b1967a1e3,"https://wedding.report/index.cfm/action/wedding_cost.estimate/budgetid/913A87B7-99EF-473C-FEEA385388F5A415#:~:text=Wedding%20Cost%20Estimate%20for%202022,your%20planning%20and%20vendor%20selection.",2022 Olympia WA Average Wedding Cost Estimate,Wedding Cost Estimate for 2022 in Olympia WA. Planning a wedding in Olympia WA? You're in the right place. This is your personaliz...,The Wedding Report,5,5,wedding.report
252f7c8a-668b-4545-bb54-3d1e931f492e,628b47f5-f9d3-4ce8-abc0-c826dcd45473,https://www.thurstoncountywa.gov/departments/district-court/services/weddings-and-marriages,Weddings and Marriages - District Court - Thurston County,Weddings and Marriages ; FEE SCHEDULE. Wedding at Courthouse. Offsite Wedding (Olympia/Lacey/Tumwater) ; Monday – Friday. Held at ...,Thurston County (.gov),6,6,www.thurstoncountywa.gov
252f7c8a-668b-4545-bb54-3d1e931f492e,328884c8-a9c6-4690-a2be-6828f30498ef,"https://www.facebook.com/groups/921470927989491/posts/3235558296580731/#:~:text=Congrats%20on%20your%20Engagement!,Kim%20Cody",Day of coordinator costs in Olympia WA for small elopement,"Dec 7, 2024 — Congrats on your Engagement! For that size, not as much as ones that are managing complex time lines, vendors, guest, e...",Facebook,7,7,www.facebook.com
252f7c8a-668b-4545-bb54-3d1e931f492e,50a87306-4220-41db-bf28-22994e083f3d,"https://liventgroup.com/how-much-does-a-200-person-wedding-cost/#:~:text=Generally%2C%20a%20200%2Dperson%20wedding,spend%20wisely%2C%20and%20party%20hard!",How Much Does a 200 Person Wedding Cost? (2025),"Apr 15, 2025 — Generally, a 200-person wedding can cost anywhere from $30,000 to over $100,000, depending on your location, venue, le...","LIV Entertainment Group, Inc.",8,8,liventgroup.com
252f7c8a-668b-4545-bb54-3d1e931f492e,ba799735-51d3-4a95-9764-4fdcce2de561,"https://eventplanwithme.com/wedding-budget-100-guests/#:~:text=%E2%80%9COkay%E2%80%A6%20but%20what%20is%20a,out%E2%80%9D%20you%20want%20to%20go.",What Is a Realistic Budget for a 100 Person Wedding? - Michaelis Events,"Nov 25, 2025 — “Okay… but what is a good budget for a wedding with 100 guests?” The short answer: in 2025, a comfortable, realistic b...",Michaelis Events,9,9,eventplanwithme.com
d9012084-8d0a-4b73-9731-a362e1d1fa6b,d60506d8-84be-4619-9957-675b31db0962,"https://www.ohiosos.gov/businesses/information-on-starting-and-maintaining-a-business/starting-a-business/#:~:text=1.,opens%20in%20a%20new%20window).",Starting a Business - Ohio Secretary of State,"1. First, register with the Ohio Secretary of State. Registration information as well as forms are available online(opens in a new...",Ohio Secretary of State (.gov),1,1,www.ohiosos.gov
