retrieval_id,aio_sources_id,source_url,source_title,source_text,source_name,source_rank,rank,root_domain
2ed36e73-9b01-4c31-b4e2-351da60df90c,b44583ad-a1ff-46d9-a3b2-d3b3296d2161,"https://www.cambrianewhaven.com/nearby-attractions#:~:text=Explore%20historic%20downtown%20New%20Haven,just%20a%20few%20miles%20away.",Things to Do in New Haven,"Explore historic downtown New Haven with the city's best shopping, dining, and entertainment right outside your door. Stroll throu...",Cambria Hotel New Haven University Area,5,5,www.cambrianewhaven.com
2ed36e73-9b01-4c31-b4e2-351da60df90c,be994b7a-4ac2-4f0b-a9d0-f9a9a5248832,"https://www.newhavenct.gov/government/departments-divisions/economic-development-administration/why-new-haven/promoting-new-haven-s-cultural-economy#:~:text=Known%20as%20a%20place%20where,and%20an%20acclaimed%20culinary%20scene.","Arts, Entertainment, Dining & Shopping: New Haven's Cultural ...","Known as a place where transformative ideas take shape—from the invention of the cotton gin to modern breakthroughs in bioscience,",City of New Haven (.gov),6,6,www.newhavenct.gov
2ed36e73-9b01-4c31-b4e2-351da60df90c,2019ec6d-02ee-49d3-8a7d-3fb6cc55de31,https://visitnewhaven.com/events-calendar/annual-events/,Annual Events - Visit New Haven CT,"Dec 1, 2025 — * CT Winter Wine Trail. January-March. www.ctwine.com. Eagle Watches on the Connecticut River from the Audubon Shop, Ma...",Visit New Haven CT,7,7,visitnewhaven.com
2ed36e73-9b01-4c31-b4e2-351da60df90c,ea578fda-715e-4e01-9182-b9d3ca6cb1fc,"https://visitnewhaven.com/things-to-do/nightlife/#:~:text=Toad's%20Places%20has%20a%20legendary,of%20the%20legendary%20Palace%20Theater.",Nightlife - Visit New Haven CT,Toad's Places has a legendary stage that has hosted the Rolling Stones and Bruce Springsteen. Firehouse 12 is an architecturally s...,Visit New Haven CT,8,8,visitnewhaven.com
2ed36e73-9b01-4c31-b4e2-351da60df90c,662b4eae-216f-4d9c-9d2a-b24a8295364a,https://www.tripadvisor.com/Attractions-g28928-Activities-Connecticut.html,THE 15 BEST Things to Do in Connecticut (2025) - Tripadvisor,"Jun 29, 2025 — Top Attractions in Connecticut * Mystic Seaport Museum. 4.5. (3,577) History Museums. ... * Foxwoods Resort Casino. 3.",Tripadvisor,9,9,www.tripadvisor.com
2ed36e73-9b01-4c31-b4e2-351da60df90c,ac29b583-82dc-46b1-bdf4-5915f0e4c0f5,"https://www.viator.com/New-Haven/d23481#:~:text=Yale%20University%20Art%20Gallery.%20Spanning%20a%20block,home%20to%20more%20than%20300%2C000%20art%20objects.",THE BEST 15 Things To Do in New Haven (UPDATED 2025) | Attractions & Activities,"Yale University Art Gallery. Spanning a block and a half of prime real estate in downtown New Haven, this sprawling exhibition spa...",Viator,10,10,www.viator.com
2ed36e73-9b01-4c31-b4e2-351da60df90c,fd61b3e3-5918-432e-b69d-e17c282353c3,"https://newhaventowers.com/new-haven-fall-events-2025/#:~:text=Faxon%20Law%20New%20Haven%20Road%20Race%20%E2%80%94,your%20apartment%20after%20cheering%20on%20the%20participants.",Your Guide to New Haven's Best Fall Events \u0026 Activities (2025),Faxon Law New Haven Road Race — September 1 The city's biggest running tradition returns on Labor Day. You can step ou...,New Haven Towers,11,11,newhaventowers.com
2ed36e73-9b01-4c31-b4e2-351da60df90c,d4d934c9-2d63-4a5a-8b25-4a36e4a2cf32,"https://www.nbcconnecticut.com/news/local/thousands-spend-labor-day-at-faxon-law-road-race-in-new-haven/3097615/#:~:text=Thousands%20spend%20Labor%20Day%20at%20Faxon%20Law,on%20September%204%2C%202023%20at%2011:44%20am",Thousands spend Labor Day at Faxon Law Road Race in New Haven,Thousands spend Labor Day at Faxon Law Road Race in New Haven It's a holiday tradition that draws big crowds to New Hav...,NBC Connecticut,12,12,www.nbcconnecticut.com
2ed36e73-9b01-4c31-b4e2-351da60df90c,463d5921-b20c-4956-ab32-bf4c7e30eecf,"https://www.infonewhaven.com/#:~:text=Plan%20like%20a%20local%20with%20our%20comprehensive,for%20the%20latest%20events%20in%20New%20Haven.",New Haven Connecticut – Visit | Stay | Play | Live Here | Elm City,"Plan like a local with our comprehensive city-wide calendar. Concerts, gallery openings, trivia nights, and special ev...",www.infonewhaven.com,13,13,www.infonewhaven.com
2ed36e73-9b01-4c31-b4e2-351da60df90c,5e3ec1c4-b8a0-46d1-a833-6b171de32bbb,"https://www.creativeground.org/profile/arts-council-greater-new-haven-incorporated#:~:text=Arts%20Council%20of%20Greater%20New%20Haven%20Free,page%2C%20resources%20for%20artists%20and%20much%20more",Arts Council of Greater New Haven - CreativeGround,Arts Council of Greater New Haven Free Membership - The Arts Council is committed to providing equitable access to our programs th...,CreativeGround,14,14,www.creativeground.org
0226be39-67f2-439b-9da2-5be4a7c31a26,17eb1b11-28fa-4a42-859e-434bd6d13100,https://explorecantonga.com/blog/dont-miss-these-canton-must-dos-in-2025/,"Don't miss these Canton Must-Dos in 2025! | Explore Canton, GA","Dec 29, 2024 — Other annual events in Canton include: * **First Fridays** This downtown block party features live music, food trucks,","Explore Canton, GA",1,1,explorecantonga.com
0226be39-67f2-439b-9da2-5be4a7c31a26,ab90f943-f491-466d-9671-21daca42c4d9,"https://explorecantonga.com/events/annual-events/#:~:text=Canton%2C%20Georgia%20has%20many%20festivals%20and%20annual,Downtown**%20*%20**Ice%20skating%20at%20The%20Mill**","Annual Events | Explore Canton, GA","Canton, Georgia has many festivals and annual events. Some of the festivals include: * **Riverfest Arts and Crafts Festival** * **","Explore Canton, GA",2,2,explorecantonga.com
0226be39-67f2-439b-9da2-5be4a7c31a26,503f58b6-a39d-4c01-bd07-3b9ceea8fb38,"https://www.mariasimsgroup.com/blog/explore-canton-ga-hidden-gems-local-favorites#:~:text=%F0%9F%8F%9E%20The%20Mill%20on%20Etowah,Looking%20for%20a%20quiet%20escape?","Explore Canton, GA: Hidden Gems & Local Favorites","Jul 30, 2025 — 🏞 The Mill on Etowah. Once an old denim factory, The Mill on Etowah has transformed into a lively mixed-use destinati...",Maria Sims Group,3,3,www.mariasimsgroup.com
0226be39-67f2-439b-9da2-5be4a7c31a26,ea4e6e65-d305-4292-9995-46533da079be,"https://issuu.com/enjoycherokeemagazine/docs/the_modern_style_of_historic_canton#:~:text=In%20the%20mid%2D1970s%2C%20a,Heritage%20Park%2C%20and%20the%20final",The Modern Style of Historic Canton - Issuu,"Jul 16, 2025 — In the mid-1970s, a troop of Boy Scouts began an ambitious project to take an existing footpath along the Etowah River...",Issuu,4,4,issuu.com
0226be39-67f2-439b-9da2-5be4a7c31a26,74f97813-5923-4288-b911-d93cc7bdc36b,"https://www.cantonga.gov/government/departments/police/canton-multicultural-festival-304#:~:text=Canton%2C%20GA,-Home%20Menu&text=The%20Canton%20Multicultural%20Festival,all%20of%20those%20who%20attend.",Canton Multicultural Festival,"Canton, GA ... The Canton Multicultural Festival is a free event created to celebrate and strengthen community relationships among...","Canton, GA (.gov)",5,5,www.cantonga.gov
0226be39-67f2-439b-9da2-5be4a7c31a26,c3d1b474-4e72-4adf-b7f6-d20910f5dd45,https://www.cantonga.gov/our-city/advanced-components/list-detail-pages/calendar-meeting-list,"Events List - Canton, GA","Events List * Dec. 5:00 PM - 5:45 PM. Events. Reception Honoring Sandy McGrew, City Council Ward 1. * Dec. 5:30 PM - 8:00 PM. Even...","Canton, GA (.gov)",6,6,www.cantonga.gov
0226be39-67f2-439b-9da2-5be4a7c31a26,07040593-c750-4e8f-be27-c12d06d6a545,"https://explorecantonga.com/blog/celebrate-culture-and-community-at-the-canton-multicultural-festival/#:~:text=A%20Taste%20of%20the%20World,with%20the%20heritage%20behind%20them.",Celebrate Culture and Community at the Canton Multicultural Festival,"Oct 1, 2025 — A Taste of the World One of the highlights of the festival is the chance to sample authentic dishes from around the wor...","Explore Canton, GA",7,7,explorecantonga.com
0226be39-67f2-439b-9da2-5be4a7c31a26,5dd86e22-5511-45e7-9d7c-4fe3dc3a00c0,"https://www.cantonga.gov/our-city/visit-us/arts-commission#:~:text=Magpies%20as%20omens%20of%20change,to%20celebrate%20arts%20and%20culture",Canton Cultural Arts Commission,Magpies as omens of change (shirt pattern) House shapes to celebrate neighborhoods as collective vessels of safety. Ladders for cl...,"Canton, GA (.gov)",8,8,www.cantonga.gov
0226be39-67f2-439b-9da2-5be4a7c31a26,68cce0a0-b993-4496-b12a-221544de6047,"https://patch.com/georgia/canton-ga/explore-history-nature-culture-canton-sixes-area#:~:text=These%20events%20are%20a%20great,or%20have%20some%20weekend%20fun.",How Much Do You Know About The Canton-Sixes Area? - Patch,"Feb 23, 2023 — These events are a great way to experience the local culture and have some fun. For a taste of the local cuisine, be s...",Patch,9,9,patch.com
0226be39-67f2-439b-9da2-5be4a7c31a26,132b0b0b-846d-4e00-acce-f61302e9b334,"https://explorecantonga.com/blog/from-past-to-present-discover-cherokee-countys-history/#:~:text=Cherokee%20County%20History%20Museum%20&%20Visitors%20Center&text=The%20museum%20also%20features%20countless,to%20take%20home%20with%20you!",From Past to Present: Discover Cherokee County's History,"Jan 16, 2025 — Cherokee County History Museum & Visitors Center ... The museum also features countless interactive exhibits and touch...","Explore Canton, GA",10,10,explorecantonga.com
0226be39-67f2-439b-9da2-5be4a7c31a26,09244af8-b72a-44c0-96f0-df94a4a5cfa3,"https://www.etowahmill.com/#:~:text=HISTORY,Mills%20were%20closed%20in%201981.",The Mill on Etowah,"HISTORY. Formerly known as Mill #1, the factory was built in 1900 and actively produced denim until 1981. Mill #1 along with its s...",The Mill on Etowah,11,11,www.etowahmill.com
0226be39-67f2-439b-9da2-5be4a7c31a26,a68dc45b-bd28-41ed-bdc2-bf029ebd662a,"https://exploregeorgia.org/city/canton#:~:text=Downtown%20Canton%20is%20packed%20with,Friday%20concerts%20Mary%20through%20October.",Canton - Explore Georgia,"Downtown Canton is packed with local restaurants, craft breweries and a handful of places to pick up a coffee and sweet treat. Pla...",Explore Georgia,12,12,exploregeorgia.org
0226be39-67f2-439b-9da2-5be4a7c31a26,2aa81aeb-ccb5-4524-88f7-043072a77355,"https://lorilanerealestate.com/blog/is-canton-georgia-a-good-place-to-retire#:~:text=Canton%20takes%20pride%20in%20its%20historical%20roots%2C,plays%20and%20musicals%20light%20up%20the%20stage.",Is Canton Georgia a good place to retire? | Lori Lane Real Estate,"Canton takes pride in its historical roots, with landmarks like the 1911 Historic Canton Theatre where plays and musicals light up...",lorilanerealestate.com,13,13,lorilanerealestate.com
0226be39-67f2-439b-9da2-5be4a7c31a26,d97cbe57-956c-4ebc-b011-abc4f3a2ca9d,"https://destinationcherokeega.com/canton/canton-events/#:~:text=There%20are%20many%20things%20to%20do%20in,with%20live%20entertainment%20and%20extended%20shopping%20hours",Canton Events - Destination Cherokee,"There are many things to do in Canton, Georgia, including events, festivals, and other activities.**Events** * **Canton 4th of Jul...",Destination Cherokee,14,14,destinationcherokeega.com
485b7410-94b6-463c-9748-0fd7808fec86,480d211b-bd9d-4109-bf67-17796fe44659,"https://www.a2gov.org/systems-planning/water-resources/stormwater/#:~:text=What%20it%20means%20to%20be,based%20data%20and%20innovative%20solutions.",Stormwater | City of Ann Arbor,"What it means to be Stormwater ​Smart​ In Ann Arbor, we know that the Huron River is vital to our community because it's our prima...",City of Ann Arbor,1,1,www.a2gov.org
485b7410-94b6-463c-9748-0fd7808fec86,399d26d1-ee80-465e-824f-c943616a9c84,"https://www.annarbor.org/things-to-do/recreation-outdoors/huron-river/#:~:text=The%20Huron%20River%2C%20winding%20through,more%20about%20the%20dam%20project.",The Huron River Water Trail,"The Huron River, winding through Ann Arbor, Dexter, and Ypsilanti, is a favorite spot for all kinds of recreation. From kayaking a...",Destination Ann Arbor,2,2,www.annarbor.org
485b7410-94b6-463c-9748-0fd7808fec86,b673b8ab-4bab-4972-9590-01711640dba8,"https://www.a2gov.org/systems-planning/water-resources/drinking-water/#:~:text=The%20Ann%20Arbor%20water%20supply,located%20south%20of%20Ann%20Arbor.",Drinking Water | City of Ann Arbor,The Ann Arbor water supply is comprised of both surface and groundwater sources. Approximately 85% of the water comes from the Hur...,City of Ann Arbor,3,3,www.a2gov.org
485b7410-94b6-463c-9748-0fd7808fec86,1692e6f2-75ef-4aa9-bc6a-cbcea4a5fa65,"https://en.wikipedia.org/wiki/Huron_River#:~:text=The%20Huron%20River%20is%20a,were%20developed%20along%20its%20banks.",Huron River - Wikipedia,"The Huron River is a 130-mile-long (210 km) river in southeastern Michigan, rising out of the Huron Swamp in Springfield Township ...",Wikipedia,4,4,en.wikipedia.org
485b7410-94b6-463c-9748-0fd7808fec86,255512ac-f437-4ec5-ac44-d4eb443e539a,"https://huronriverwatertrail.org/#:~:text=The%20Huron%20River%20Water%20Trail%20is%20a%20104%2Dmile%20(167,universally%20accessible%20canoe%20kayak%20launch.",Welcome to the Huron River Water Trail!,"The Huron River Water Trail is a 104-mile (167 km) inland paddling trail connecting people to the river's natural environment, its...",Huron River National Water Trail,5,5,huronriverwatertrail.org
485b7410-94b6-463c-9748-0fd7808fec86,0b58c9e0-c266-42a7-a3bf-6a48b7eec61f,"https://huronriverwatertrail.org/trail-towns/ann-arbor/#:~:text=The%20Huron%20River%20in%20Ann%20Arbor%2C%20Michigan,kayak%20launch%20*%20**Gallup%20Park%20Canoe%20Livery**","Visit Ann Arbor, Your Trip on the Huron River","The Huron River in Ann Arbor, Michigan has a 53-46 mile trail. The trail includes: * **Parks** Public launches and parking, includ...",Huron River National Water Trail,6,6,huronriverwatertrail.org
485b7410-94b6-463c-9748-0fd7808fec86,c3349123-f65d-428e-908e-452562c04ace,"https://www.a2gov.org/parks-and-recreation/parks-and-places/island-park/#:~:text=Overview,the%20banks%20of%20the%20river.",Island Park | City of Ann Arbor,Overview. Island Park​ is a 5.6-acre park located on Island Drive and encompasses a 1.8-acre island located in the middle of the H...,City of Ann Arbor,7,7,www.a2gov.org
485b7410-94b6-463c-9748-0fd7808fec86,cc60ce95-aa3d-4982-9df0-b5932aefe873,"https://www.a2gov.org/systems-planning/water-resources/#:~:text=%E2%80%8B%E2%80%8B%E2%80%8BOur%20Watershed,Traver%20Creek%E2%80%8B",Water Resources | City of Ann Arbor,"​​​Our Watershed The Huron River flows through seven counties including: Oakland, Livingston, Jackson, Washtenaw, Wayne and Monroe...",City of Ann Arbor,8,8,www.a2gov.org
1411e7da-dad8-4a04-bf84-e6b8821152d7,94463efe-b18c-4251-8e25-c8305206f4a1,"https://realtytimes.com/consumeradvice/ask-the-expert/item/1049682-is-georgetown-delaware-a-good-place-to-live#:~:text=As%20more%20people%20discover%20the,individuals%20looking%20for%20local%20employment.","Is Georgetown, Delaware, a Good Place to Live? - Realty Times","Jul 11, 2024 — As more people discover the appeal of the town, new businesses and amenities are popping up. This growth is also leadi...",Realty Times,1,1,realtytimes.com
1411e7da-dad8-4a04-bf84-e6b8821152d7,def2ce96-a5ab-4e26-ae6a-a4f484066404,https://www.mashvisor.com/cities/de/georgetown-investment-property-guide,"Investment Property in GEORGETOWN, DE - Mashvisor","Aug 31, 2025 — GEORGETOWN, DE Real Estate Investment Performance * PROPERTY SALE PRICE. $ 449,950. Median. 2,212. Avg/Sq.ft. * CASH O...",Mashvisor,2,2,www.mashvisor.com
1411e7da-dad8-4a04-bf84-e6b8821152d7,2a26e970-adae-4a92-8068-fa5a3c4476c3,"https://therealmccoygroup.com/blog/posts/2024/08/07/coastal-delaware-a-booming-real-estate-market/#:~:text=Suburban%20Charm,experience%2C%20consider%20the%20following%20tips:",Coastal Delaware Real Estate | Thriving Towns,"Aug 6, 2024 — Suburban Charm. Georgetown: Historical Charm. As the county seat, Georgetown offers a mix of historical charm and moder...",The Real McCoy Group,3,3,therealmccoygroup.com
1411e7da-dad8-4a04-bf84-e6b8821152d7,5ad2b169-6d66-4144-9e27-eb2721878b78,"https://www.realtor.com/realestateandhomes-search/Georgetown_DE/overview#:~:text=Sale%2Dto%2Dlist%20price%20ratio,than%20the%20demand%20for%20homes.","Georgetown, DE 2025 Housing Market | realtor.com®","Sale-to-list price ratio: 100% Homes in Georgetown, DE sold for approximately the asking price on average in September 2025. Buyer...",Realtor.com,4,4,www.realtor.com
1411e7da-dad8-4a04-bf84-e6b8821152d7,a977cfbd-41a7-4321-b7a1-bf3ec4acce43,"https://www.activeadultsdelaware.com/area/georgetown-de/#:~:text=and%20Atlantic%20beaches.-,Outstanding%20Communities,to%20find%20it%20in%20Georgetown.","Real Estate and Homes for Sale in Georgetown, DE","Outstanding Communities Georgetown DE is home to numerous beautiful communities ideal for retirees, vacationers, and residents of ...",Active Adults Realty,5,5,www.activeadultsdelaware.com
1411e7da-dad8-4a04-bf84-e6b8821152d7,4a8d544e-d8c8-4680-b6c0-5a27ab2c248a,"https://www.homes.com/georgetown-de/#:~:text=Home%20Trends%20in%20Georgetown%2C%20DE,over%20the%20previous%2012%20months.","Georgetown, DE Homes for Sale & Real Estate","Home Trends in Georgetown, DE On average, homes in Georgetown, DE sell after 261 days on the market compared to the national avera...",Homes.com,6,6,www.homes.com
1411e7da-dad8-4a04-bf84-e6b8821152d7,364b66e6-e682-40e8-bd18-209431418241,"https://www.redfin.com/city/7411/DE/Georgetown/housing-market#:~:text=Georgetown%2C%20DE%20Housing%20Market,Read%20More",Georgetown Housing Market: House Prices & Trends | Redfin,"Georgetown, DE Housing Market. Homes for sale. The Georgetown housing market is somewhat competitive. The median sale price of a h...",Redfin,7,7,www.redfin.com
1411e7da-dad8-4a04-bf84-e6b8821152d7,8ab29ba4-58bc-4db8-9e09-79ee41ebb030,"https://www.zillow.com/shortly-georgetown-de/home-values/#:~:text=$360%2C106&text=The%20average%20Georgetown%2C%20DE%20home,0.9%25%20over%20the%20past%20year.","Georgetown, DE Housing Market: 2025 Home Prices & Trends - Zillow","$360,106. ... The average Georgetown, DE home value is $360,106, up 0.9% over the past year.",Zillow,8,8,www.zillow.com
1411e7da-dad8-4a04-bf84-e6b8821152d7,a3cd12da-4b3a-4b74-beac-6a45c709e0bf,"https://visitsoutherndelaware.com/area-info/georgetown#:~:text=Georgetown%2C%20the%20county%20seat%20of,to%20ocean%20beaches%2C%20and%20more.",Area Info > Georgetown | Visit Southern Delaware,"Georgetown, the county seat of Sussex County, offers scenic beauty, history, a coastal airport, a speedway, unique shops like craf...",Southern Delaware Tourism,9,9,visitsoutherndelaware.com
3b75f149-38a3-454f-ad7d-fc8763cd24fc,61265c0f-35e3-4e4d-8b19-bfaf9041f715,"https://dor.georgia.gov/real-estate-transfer-tax#:~:text=The%20real%20estate%20transfer%20tax%20is%20based%20upon%20the%20property's,buyer%20will%20pay%20the%20tax.",Real Estate Transfer Tax | Department of Revenue - Georgia.gov,Real Estate Transfer Tax. Real estate transfer tax is an excise tax on transactions involving the sale of real property where titl...,Georgia.gov,1,1,dor.georgia.gov
3b75f149-38a3-454f-ad7d-fc8763cd24fc,2c0c2d0f-3f5a-4d1f-8c4a-944cb4e1aed1,"https://dor.georgia.gov/intangible-recording-real-estate-transfer-tax-letter-rulings#:~:text=Search%20for%20IRT%20&%20RETT%20Letter%20Rulings,-Begin%20your%20search&text=Every%20holder%20of%20a%20long,appropriate%20Clerk%20of%20Superior%20Court.",Intangible Recording & Real Estate Transfer Tax Letter Rulings,Search for IRT & RETT Letter Rulings ... Every holder of a long-term note secured by real estate must record the security instrume...,Georgia.gov,2,2,dor.georgia.gov
3b75f149-38a3-454f-ad7d-fc8763cd24fc,a8bfe7fb-2627-47f2-9b30-7496f41c09de,"https://atlantatitleco.com/Mortage-Lender-Toolbox/Georgia-Transfer-Tax-Calculator/#:~:text=The%20State%20of%20Georgia%20seller's,will%20calculate%20the%20correct%20amount.",Georgia Transfer Tax Calculator - Atlanta Title Company,State of Georgia Seller's Transfer Tax Calculator. ... The State of Georgia seller's transfer tax is a real estate recording tax b...,Atlanta Title Company,3,3,atlantatitleco.com
3b75f149-38a3-454f-ad7d-fc8763cd24fc,f0af6816-d19c-4e18-bf86-6805161975f4,"https://www.homelight.com/blog/georgia-transfer-tax-calculator/#:~:text=How%20the%20Georgia%20Transfer%20Tax,more:%20Understanding%20Georgia's%20Transfer%20Tax",Georgia Transfer Tax Calculator for Home Sellers - HomeLight,"Jul 8, 2025 — Georgia Transfer Tax Calculator. ... How much transfer tax might you pay when selling a home in Georgia? ... Georgia ch...",HomeLight,4,4,www.homelight.com
3b75f149-38a3-454f-ad7d-fc8763cd24fc,7cac17bf-4543-4f59-82bd-7c4d16f1d425,"https://law.justia.com/codes/georgia/title-48/chapter-6/article-1/section-48-6-1/#:~:text=There%20is%20imposed%20a%20tax,by%20the%20sale)%20exceeds%20$100.00.",Georgia Code § 48-6-1 (2024) - Transfer tax rate - Justia Law,Chapter 6 - TAXATION OF INTANGIBLES (§§ 48-6-1 — 48-6-98) Article 1 - REAL ESTATE TRANSFER TAX (§§ 48-6-1 — 48-6-10) Section 48-6-,Justia Law,5,5,law.justia.com
3b75f149-38a3-454f-ad7d-fc8763cd24fc,c85cb134-6c3c-4f0c-b6a6-320b71c37930,"https://georgiatitle.com/Real-Estate-Taxes/GA-Transaction-Taxes/index.html#:~:text=The%20State%20of%20Georgia%20Transfer,to%20Secure%20Debt%20/%20Security%20Deed.",Georgia Title | Transfer Tax | Intangibles Tax | Mortgage Tax,The State of Georgia Transfer Tax is imposed at the rate of $1.00 per thousand (plus $0.10 / hundred) based upon the value of the ...,Georgia Title & Escrow Company,6,6,georgiatitle.com
3b75f149-38a3-454f-ad7d-fc8763cd24fc,427cdcd2-a52d-4e6b-b8af-d03b63fd4c80,"https://www.rsjohnsonlegal.com/whats-a-transfer-tax/#:~:text=As%20adults%2C%20there%20is%20something,3.",What's a Transfer Tax? - rsjohnsonlegal,"Jun 23, 2022 — What's a Transfer Tax? * Shorthand for Calculating a transfer tax: The transfer tax is approximately 1% of the sale pr...",RS Johnson Legal,7,7,www.rsjohnsonlegal.com
3b75f149-38a3-454f-ad7d-fc8763cd24fc,b55d01e6-13e8-47ed-b648-0940d78d449e,"https://www.avalara.com/taxrates/en/state-rates/georgia/cities/ringgold.html#:~:text=Ringgold%20sales%20tax%20details,sales%20tax%20rate%20is%200%25.","2025 Ringgold, Georgia Sales Tax Calculator & Rate - Avalara","Ringgold, Georgia sales tax rate. ... *Rates are rounded to the nearest hundredth. Due to varying local sales tax rates, we strong...",Avalara,8,8,www.avalara.com
3b75f149-38a3-454f-ad7d-fc8763cd24fc,fb111371-bae7-4d11-90bb-2970cc053188,"https://dor.georgia.gov/intangible-recording-tax#:~:text=Before%20recording%20the%20security%20instrument,securing%20the%20note%20is%20located.",Intangible Recording Tax - Department of Revenue - Georgia.gov,"Jul 14, 2015 — Recording the Security Instrument. ... Before recording the security instrument with the clerk of the superior court, ...",Georgia.gov,9,9,dor.georgia.gov
3b75f149-38a3-454f-ad7d-fc8763cd24fc,f4b1b73d-b7b4-471d-99f8-5310fcb811d4,"https://atlantatitleco.com/Mortage-Lender-Toolbox/Georgia-Transfer-Tax-Calculator/#:~:text=There%20is%20imposed%20a%20tax%20at%20the,realty%20sold%20is%20granted%2C%20assigned%2C%20transferred%2C%20or",Georgia Transfer Tax Calculator - Atlanta Title Company,"There is imposed a tax at the rate of $1.00 for the first $1,000.00 or fractional part of $1,000.00 and at the rate of 10¢ for eac...",Atlanta Title Company,10,10,atlantatitleco.com
3b75f149-38a3-454f-ad7d-fc8763cd24fc,26183533-682a-483d-a0cd-0afd826b7181,"https://www.homelight.com/blog/transfer-tax-georgia/#:~:text=What%20are%20the%20types%20of,are%20exempt%20from%20these%20taxes.",Understanding Georgia's Transfer Tax: A Quick Guide,State transfer taxes. The Peach State's transfer tax is based upon the price a property sells for and is levied at a r...,HomeLight,11,11,www.homelight.com
3b75f149-38a3-454f-ad7d-fc8763cd24fc,911abc65-6476-4960-9890-f3ff5f765092,"https://www.rismedia.com/2023/11/16/who-pays-real-estate-transfer-taxes-at-closing/#:~:text=Transfer%20tax%20payment:%20They%20are%20typically%20paid,for%20and%20transmitted%20to%20the%20appropriate%20authorities.",Who Pays Real Estate Transfer Taxes at Closing?,Transfer tax payment: They are typically paid at the closing of a real estate transaction. The closing agent often col...,RISMedia,12,12,www.rismedia.com
3b75f149-38a3-454f-ad7d-fc8763cd24fc,80b148dc-df39-4aa4-b44c-14ea739ad2c0,"https://www.orchestrate.com/blog/understanding-us-title-taxes-a-comprehensive-guide/#:~:text=Title%20taxes%20are%20typically%20paid%20at%20closing,is%20sent%20to%20the%20local%20tax%20authority.",US Title \u0026 Tax Guide Explained | Orchestrate,"Title taxes are typically paid at closing during the real estate transaction process. In most cases, the title company, real estat...",Orchestrate Mortgage and Title Solutions,13,13,www.orchestrate.com
3b75f149-38a3-454f-ad7d-fc8763cd24fc,c8c4cb4b-01ca-4028-8633-1b50f175baff,"https://rules.sos.ga.gov/gac/560-11-8#:~:text=A%20short%2Dterm%20note%2C%20with%20option%20to%20renew,years%20from%20execution%20is%20classified%20as%20long%2Dterm.",GAC - Subject 560-11-8 INTANGIBLE RECORDING TAX,"A short-term note, with option to renew or extend by the borrower, where any part of the principal or interest of the note becomes...",Georgia.gov,14,14,rules.sos.ga.gov
3b75f149-38a3-454f-ad7d-fc8763cd24fc,5ef995fd-5a61-4bd0-a417-a5bfd2b34180,"https://origintitle.com/news/change-in-the-intangible-tax-rule-in-georgia/#:~:text=The%20tax%20rate%20is%20$1.50%20for%20each,years%20from%20the%20date%20of%20the%20note.",Change in the Intangible Tax Rule in Georgia - Origin Title \u0026 Escrow ...,"The tax rate is $1.50 for each $500.00, or fraction thereof, of the amount listed on the security deed. The intangible ...","Origin Title \u0026 Escrow, Inc.",15,15,origintitle.com
