retrieval_id,aio_sources_id,source_url,source_title,source_text,source_name,source_rank,rank,root_domain
d9012084-8d0a-4b73-9731-a362e1d1fa6b,4d7a758e-25e1-476b-8e48-3f7bdacefab2,"https://ohio.gov/business/resources/start-a-business#:~:text=Don't%20see%20your%20business,for%20limited%20English%20proficient%20individuals.",Start a Business | Ohio.gov | Official Website of the State of Ohio,"Dec 31, 2024 — Don't see your business type listed? Contact your local Small Business Development Center (SBDC). Find More Help. Smal...",Ohio.gov,2,2,ohio.gov
d9012084-8d0a-4b73-9731-a362e1d1fa6b,ec591576-9db0-4580-ba1e-f146262e4a22,https://govdocfiling.com/states/llc-ohio/,How to Start an LLC in Ohio for Free - GovDocFiling,Below is a breakdown of the process of forming an LLC in Ohio. * Find a Business Idea. * Create a Business Plan. * Choose a Name f...,GovDocFiling,3,3,govdocfiling.com
d9012084-8d0a-4b73-9731-a362e1d1fa6b,53e3fff5-937a-475e-863b-0facce83d75a,"https://www.knoxchamber.com/entrepreneur-center/#:~:text=It's%20important%20to%20remember%20to,villages%20and%20in%20Mount%20Vernon.",Entrepreneur Center - Knox County Chamber of Commerce,It's important to remember to get your business out in the community. This can be done by creating shirts or hats with your busine...,Knox County Chamber of Commerce Ohio,4,4,www.knoxchamber.com
d9012084-8d0a-4b73-9731-a362e1d1fa6b,258daa31-c0cc-4669-9c8f-9ce65219dd31,https://www.youtube.com/watch?v=AC_-CLNJU6g&t=175,How to Start a Business in Ohio,"Oct 14, 2021 — although you can appoint a law firm or a service company as your statutory agent An entity can act as their own statut...",YouTube,5,5,www.youtube.com
d9012084-8d0a-4b73-9731-a362e1d1fa6b,fa9775a0-8c02-42fc-bfac-d6abe6164120,"https://www.troyohiochamber.com/start-your-own-business/#:~:text=You%20should%20also%20understand%20the%20City%20of,by%20the%20Ohio%20Bureau%20of%20Workers'%20Compensation",Start Your Own Business - Troy Area Chamber of Commerce,You should also understand the City of Troy Sign Regulations before installing a sign for your business. Here are some other steps...,Troy Area Chamber of Commerce,6,6,www.troyohiochamber.com
d9012084-8d0a-4b73-9731-a362e1d1fa6b,71c4378c-f01c-4a03-9c7c-ca3716971d1d,"https://www.nolo.com/legal-encyclopedia/how-get-small-business-license-ohio.html#:~:text=Your%20Ohio%20business%20might%20need%20a%20general,building%20permits%2C%20and%20a%20trade%20name%20registration.",Do You Need a Business License in Ohio?,"Oct 23, 2023 — Your Ohio business might need a general business license, professional license, vendor's license, zoning and building ...",Nolo,7,7,www.nolo.com
708168fd-e99f-4ccc-ab10-357e951a96eb,9aba1705-feb7-4bca-ac57-d84abbc8b9f8,"https://www.hud.gov/helping-americans/housing-choice-vouchers-tenants#:~:text=You%20must%20apply%20for%20rental,PHA's%20jurisdiction%20when%20they%20applied.",Housing Choice Voucher Tenants - HUD,You must apply for rental assistance through your local Public Housing Agency. You can find your local housing agency(s) in your a...,Department of Housing and Urban Development (HUD) (.gov),1,1,www.hud.gov
708168fd-e99f-4ccc-ab10-357e951a96eb,f1fa5ef4-8477-42f4-8a8b-1973f5c745bb,"https://www.usa.gov/housing-voucher-section-8#:~:text=Contact%20your%20local%20public%20housing,your%20local%20public%20housing%20agency",Section 8 housing | USAGov,"Jun 16, 2025 — Contact your local public housing agency to apply for a housing choice voucher or check the status of your application...",USA.gov,2,2,www.usa.gov
708168fd-e99f-4ccc-ab10-357e951a96eb,6aebac1a-ceb6-4f54-b40f-995359617836,"https://www.affordablehousing.com/housing-authority-ga/housing-authority-of-the-city-of-nahunta-1462/#:~:text=To%20begin%2C%20you'll%20need,properties%20that%20match%20your%20criteria.",Housing Authority of the City of Nahunta,"To begin, you'll need to create a profile on AffordableHousing.com. Then, you can use our common application to apply to multiple ...",Affordablehousing.com,3,3,www.affordablehousing.com
708168fd-e99f-4ccc-ab10-357e951a96eb,e32023bb-5b00-4a82-9c03-cc40aa1e163b,"https://dca.georgia.gov/housing-choice-voucher/housing-choice-voucher/applicant-information#:~:text=Applicant%20families%20must%20meet%20the,Project%20Based%20Pre%2DApplication%20Portal",Applicant Information | Georgia Department of Community Affairs,Applicant families must meet the following requirements: Meet HUD's definition of family. Meet income limits specified by HUD. Qua...,Georgia Department of Community Affairs (.gov),4,4,dca.georgia.gov
708168fd-e99f-4ccc-ab10-357e951a96eb,f27d81c1-073f-432f-9c2a-511055653dc8,"http://www.officialhousingauthority.com/georgia/nahunta-housing-authority/#:~:text=If%20you%20don't%20hear,any%20inaccuracies%2C%20please%20contact%20us.",Nahunta Housing Authority - Georgia,"If you don't hear back from them or have any questions, you can give them a call at (912) 462- 5680 Ext 0. OfficialHousingAuthorit...",Official Housing Authority,5,5,www.officialhousingauthority.com
08f2b932-e46d-4b91-af2e-60e074528de8,2726d739-30de-4c24-947b-21eb82046cfc,"http://censusreporter.org/profiles/16000US1671470-st-maries-id/#:~:text=Here's%20some%20demographic%20information%20about%20St.%20Maries%2C,7%25%2070%2D79%2C%2080+%20*%20**Sex**%2051%25%20female","St. Maries, ID - Profile data - Census Reporter","Here's some demographic information about St. Maries, Idaho: * **Population** 3,032 people in a 1.2 square mile area * **Median ag...",Census Reporter,1,1,censusreporter.org
08f2b932-e46d-4b91-af2e-60e074528de8,defc602a-536f-4edf-9ad2-6e592e37f3b3,"https://en.wikipedia.org/wiki/St._Maries,_Idaho#:~:text=The%20racial%20makeup%20of%20the,from%20two%20or%20more%20races.","St. Maries, Idaho - Wikipedia","The racial makeup of the city was 96.0% White, 0.3% African American, 1.1% Native American, 0.6% Asian, 0.1% Pacific Islander, 0.2...",Wikipedia,2,2,en.wikipedia.org
08f2b932-e46d-4b91-af2e-60e074528de8,5032ff34-dc24-4b38-b0fa-3ec57b6f4951,"https://datausa.io/profile/geo/idaho#:~:text=Race%20and%20Ethnicity&text=252k%20people-,In%202023%2C%20there%20were%2018.4%20times%20more%20White%20(Non%2D,are%20hispanic%20(252k%20people).",Idaho - Data USA,"Race and Ethnicity In 2023, there were 18.4 times more White (Non-Hispanic) residents (1.5M people) in Idaho than any other race o...",Data USA,3,3,datausa.io
1f9e96c2-4f33-4f50-91a5-d762ecdd7634,dd2cfe05-fcd4-404a-873d-e20ed9bc0dcd,"https://oxfordre.com/americanhistory/display/10.1093/acrefore/9780199329175.001.0001/acrefore-9780199329175-e-1111?p=emailA463xK8Kw8t8c&d=/10.1093/acrefore/9780199329175.001.0001/acrefore-9780199329175-e-1111#:~:text=Though%20considered%20a%20typical%20midwestern,solar%20energy%2C%20and%20glass%20production.",Toledo | Oxford Research Encyclopedia of American History,"Apr 16, 2024 — Though considered a typical midwestern industrial city, Toledo, Ohio has an unusual history shaped by its unique physi...",Oxford Research Encyclopedias,1,1,oxfordre.com
1f9e96c2-4f33-4f50-91a5-d762ecdd7634,5c7bbb93-099a-4685-9705-3ce78dbc07f6,"https://oxfordre.com/americanhistory/display/10.1093/acrefore/9780199329175.001.0001/acrefore-9780199329175-e-1111?p=emailASeZNhSQGhK9k&d=/10.1093/acrefore/9780199329175.001.0001/acrefore-9780199329175-e-1111#:~:text=Working%20Class%20History-,Overview,military%20campaigns%20to%20crush%20it.",Toledo | Oxford Research Encyclopedia of American History,"Apr 16, 2024 — Overview. In 2020, Toledo, known as the “Glass City” for its earliest and most important industry, was the fourth larg...",Oxford Research Encyclopedias,2,2,oxfordre.com
1f9e96c2-4f33-4f50-91a5-d762ecdd7634,5e97c269-4b80-484a-98d8-09619b7d0d86,"https://oxfordre.com/americanhistory/display/10.1093/acrefore/9780199329175.001.0001/acrefore-9780199329175-e-1111?d=%2F10.1093%2Facrefore%2F9780199329175.001.0001%2Facrefore-9780199329175-e-1111&p=emailA6C7XIQFjHcVw#:~:text=As%20it%20became%20clear%20that,rioting%20of%20the%2020th%20century.&text=This%20event%2C%20known%20as%20the,Flint%20Michigan%20strike%20was%20strengthened.",Toledo | Oxford Research Encyclopedia of American History,"Apr 16, 2024 — As it became clear that the law would not reach the men so obviously responsible for the city's economic disaster, peo...",Oxford Research Encyclopedias,3,3,oxfordre.com
1f9e96c2-4f33-4f50-91a5-d762ecdd7634,e1161abf-04a0-416b-97fb-f3bdc1107639,https://www.hamptonthink.org/read/retracing-toledos-radical-history,Retracing Toledo's Radical History — Hampton Institute,"Sep 20, 2015 — Toledo, Ohio has a long history of radicalism. The city has been the site of social, economic, and political struggle ...",Hampton Institute,4,4,www.hamptonthink.org
1f9e96c2-4f33-4f50-91a5-d762ecdd7634,774ee324-d6f6-45a9-85d9-c030e0920a86,"https://visittoledo.org/2025/02/19/7-things-you-didnt-know-about-toledo#:~:text=The%20Glass%20Capital%20of%20the,for%20NASA's%20Apollo%2011%20mission!",7 Things You Didn't Know About Toledo,"Feb 18, 2025 — The Glass Capital of the World Nicknamed the “Glass City”, Toledo is a major center for glass manufacturing, home to i...",Destination Toledo,5,5,visittoledo.org
1f9e96c2-4f33-4f50-91a5-d762ecdd7634,a25604ba-ec9a-40a3-b9d0-d3b4fbfb86f1,"https://visittoledo.org/about-toledo/about-toledo#:~:text=The%20city's%20rapid%20expansion%20was,spirit%20promise%20a%20bright%20future.",Discover Toledo: The City's Story,"The city's rapid expansion was fueled by its strategic location and the arrival of crucial industries, including glass production,",Destination Toledo,6,6,visittoledo.org
1f9e96c2-4f33-4f50-91a5-d762ecdd7634,2d37443d-81be-4ae0-9ad7-d589aa34ce90,"https://www.wtol.com/article/news/a-short-history-toledo-celebrates-its-180th-birthday/512-14346d01-b831-471e-a125-827f5ebb3310#:~:text=As%20a%20key%20industrial%20and,happened%20in%20Toledo's%20180%20years.",A Short History: Toledo celebrates its 180th birthday | wtol.com,"Jan 7, 2017 — As a key industrial and auto manufacturing center, a railroad and transportation hub, a hotbed of early social reformat...",wtol.com,7,7,www.wtol.com
1f9e96c2-4f33-4f50-91a5-d762ecdd7634,2fe5a0fe-af2b-4ef2-95e2-e9deaf5a0a07,"https://en.wikipedia.org/wiki/Toledo_War#:~:text=The%20government%20was%20spurred%20to,with%20the%20entire%20Upper%20Peninsula.",Toledo War - Wikipedia,"The government was spurred to action by the realization that a $400,000 surplus ($12 million in 2024) in the United States Treasur...",Wikipedia,8,8,en.wikipedia.org
1f9e96c2-4f33-4f50-91a5-d762ecdd7634,7921627c-53f0-4d0e-8e65-7b92dd9426ae,"https://www.toledo.com/quicklinks/toledo-ohio-history/#:~:text=By%20the%201850s%2C%20canals%20were,Confederacy%2C%20secession%2C%20and%20racism.",Toledo Ohio History,"Mar 25, 2021 — By the 1850s, canals were losing business to the quicker, more reliable railroads. The first railroad to operate west ...",Toledo.com,9,9,www.toledo.com
1f9e96c2-4f33-4f50-91a5-d762ecdd7634,2fde8d81-3f36-402e-9b93-9ad8c3040b0f,"https://oxfordre.com/americanhistory/display/10.1093/acrefore/9780199329175.001.0001/acrefore-9780199329175-e-1111?d=%2F10.1093%2Facrefore%2F9780199329175.001.0001%2Facrefore-9780199329175-e-1111&p=emailAW7WZrGdjENdc#:~:text=Most%20scholarly%20attention%20has%20centered,1650%E2%80%931815%20(1991).",Toledo | Oxford Research Encyclopedia of American History,"Apr 16, 2024 — Most scholarly attention has centered on just a few aspects of Toledo's history. Early national historians have focuse...",Oxford Research Encyclopedias,10,10,oxfordre.com
1f9e96c2-4f33-4f50-91a5-d762ecdd7634,4b8775b1-9896-45a9-86bb-22cd647c4c99,https://toledohistorymuseum.org/,"Toledo History Museum – preserving and promoting the history of Toledo, Ohio through exhibitions, outreach & education","Some other Toledo history topics include: * **Automobile manufacturing** In the early 20th century, Toledo was a major hub for aut...",Toledo History Museum,11,11,toledohistorymuseum.org
1f9e96c2-4f33-4f50-91a5-d762ecdd7634,db12d66a-d252-4681-bd5e-8790f1c13759,"https://www.michigan.gov/dmva/about/history/military-events/highlights/the-toledo-war#:~:text=The%20war%20began%20when:%20*%20**Michigan's%20militia,territory%20did%20not%20include%20the%20Toledo%20Strip.",The Toledo War,"The war began when: * **Michigan's militia arrested some Ohio officials, captured nine surveyors, and fired a few shots over the h...",State of Michigan (.gov),12,12,www.michigan.gov
245f8614-2916-4c3f-97d6-d9f102084807,ce942f58-2ffe-41be-b7e2-bc4ffe384bed,"https://www.usnews.com/education/best-high-schools/california/rankings/fresno-ca-23420#:~:text=Search%20by%20State-,University%20High%20School%20(Fresno),Fresno%2C%20CA","Best High Schools in Fresno, CA Area - US News","University High School (Fresno) Fresno, CA. University High District. #1in Fresno, CA Metro Area Rankings. #63 in National Ranking...",U.S. News & World Report,1,1,www.usnews.com
245f8614-2916-4c3f-97d6-d9f102084807,5103062d-825d-4050-a787-9e0d6c89dbad,"https://cardenschooloffresno.com/#:~:text=Welcome%20to%20Carden!,we%20guide%20students%20towards%20greatness.",Carden School of Fresno | Best private schools near me fresno,"Welcome to Carden! Welcome to Carden School of Fresno, your neighborhood's outstanding secular private school for students from Jr...",Carden School of Fresno,2,2,cardenschooloffresno.com
245f8614-2916-4c3f-97d6-d9f102084807,fa728b04-58da-42c8-9cd1-558caef4f00f,"https://www.fresnobee.com/news/local/article293316814.html#:~:text=The%20alternative%20school%20%E2%80%9Cuses%20an,The%20Fresno%20Bee%20previously%20reported.",Best public schools in Fresno CA? Top 10 ranked by Niche,"Oct 2, 2024 — The alternative school “uses an independent study learning strategy,” it said on its website. The school scored A grade...",Fresno Bee,3,3,www.fresnobee.com
245f8614-2916-4c3f-97d6-d9f102084807,d6dc54ef-2d19-44fe-8044-db781e467b89,https://www.niche.com/k12/search/best-private-high-schools/c/fresno-county-ca/,2026 Best Private High Schools in Fresno County - Niche,"* #1 Best Private High Schools in Fresno County. San Joaquin Memorial High School. Fresno, CA. Private School. 9-12. Rating 3.62 o...",Niche,4,4,www.niche.com
245f8614-2916-4c3f-97d6-d9f102084807,34aae9b8-3c3f-4ec8-a462-e4bdec2147f4,"https://www.niche.com/k12/fresno-adventist-academy-fresno-ca/#:~:text=Fresno%20Adventist%20Academy%20is%20a%20private%2C%20Adventist,K%2D12%20Schools%20in%20California**%20%23106%20of%20218","Fresno Adventist Academy in Fresno, CA - Niche","Fresno Adventist Academy is a private, Adventist school in Fresno, California. It has 155 students in grades K-12 with a student-t...",Niche,5,5,www.niche.com
245f8614-2916-4c3f-97d6-d9f102084807,baa0b398-81d9-465d-b11e-839dcfb46eef,https://www.youtube.com/watch?v=FnW90HhLBLw&t=244,"Discover Northeast Fresno: Top Schools, Trendy Spots ...","Aug 27, 2024 — we are on the dividing. line the east and west dividing okay so let's talk about education northeast Fresno is home to...",YouTube,6,6,www.youtube.com
245f8614-2916-4c3f-97d6-d9f102084807,f7e2f6b5-090f-4502-b46b-657faae6655c,"https://www.fresnounified.org/departments/ccr/cte/schools/fresno#:~:text=Fresno%20High%20is%20an%20International,construction%20and%20HVAC%20technician%20careers",Fresno High School,Fresno High is an International Baccalaureate (IB) World School with three IB Career-Related Programmes for students to immerse th...,Fresno Unified School District,7,7,www.fresnounified.org
245f8614-2916-4c3f-97d6-d9f102084807,dd961fb8-d4c7-4c9c-83e5-4339e27259ed,"https://gracemoving.com/blog/best-fresno-high-schools/#:~:text=This%20fabulous%20school%20is%20known,School%20With%20Focus%20on%20Religion",Best High Schools in Fresno CA - Grace Moving Company,"May 5, 2024 — This fabulous school is known for being one of the best private high schools in Fresno for athletics. Students are enco...",Grace Moving Company,8,8,gracemoving.com
245f8614-2916-4c3f-97d6-d9f102084807,4a3f866a-3f1e-4551-8d1d-096520853730,"https://uhsfresno.com/documents/Counseling/SchoolProfile2023-24.pdf#:~:text=Niche.com%20ranked%20our%20school%202nd%20best%20chater,inflation%20is%20not%20part%20of%20our%20culture.",2023-24 SCHOOL PROFILE - University High School Fresno,"Niche.com ranked our school 2nd best chater high school in California, 27th best public high school in California and 6th Best Tea...",University High School Fresno,9,9,uhsfresno.com
81f1108d-9489-4392-b0d2-806d6872ad2f,559f7aff-f6e4-4b6e-a467-ca53576f6eab,"https://divorcepro-wi.com/low-cost-hudson-divorce-lawyer-mediation/#:~:text=Croix%20County%20Family%20Court,handles%20all%20new%20case%20filings.",Divorce Mediation | Low Cost Divorce | Hudson,Croix County Family Court. The Family Court is located at the St. Croix County Courthouse and is presided over by Family Court Com...,Divorce PRO Wisconsin,1,1,divorcepro-wi.com
81f1108d-9489-4392-b0d2-806d6872ad2f,21f1af39-f273-498f-be3a-b2f8145f26b1,"https://sccwi.gov/FAQ.aspx?QID=104#:~:text=FAQs%20%E2%80%A2%20Where%20do%20I,County%20Clerk%20of%20Court%20office.",FAQs • Where do I get forms to file a lawsuit? - St. Croix County,"FAQs • Where do I get forms to file a lawsuit? Where do I get forms to file a lawsuit? Small Claims, divorce / legal separation fo...",St. Croix County (.gov),2,2,sccwi.gov
81f1108d-9489-4392-b0d2-806d6872ad2f,949346ef-19fb-42c6-bdc2-f8572ce2a096,"https://www.co.lincoln.wi.us/clerk-courts/page/family#:~:text=Family%20cases%20are%20filed%20with%20the%20Clerk,about%20procedures%2C%20but%20cannot%20give%20legal%20advice.","Family | Lincoln County, WI",Family cases are filed with the Clerk of Court in Lincoln County. These cases include: * Establishing paternity * Divorce * Legal ...,"Lincoln County, WI",3,3,www.co.lincoln.wi.us
81f1108d-9489-4392-b0d2-806d6872ad2f,66f604d5-5042-4ba5-a422-8758ab96829f,"https://www.wicourts.gov/formdisplay/FA-4100V_instructions.pdf?formNumber=FA-4100V&formType=Instructions&formatId=2&language=en#:~:text=The%20summons%20and%20petition%20(or,can%20hear%20the%20final%20hearing.)",Basic Guide to Divorce/Legal Separation - Wisconsin Court System,The summons and petition (or joint petition) for divorce or legal separation and confidential petition addendum must be filed and ...,Wisconsin Court System (.gov),4,4,www.wicourts.gov
81f1108d-9489-4392-b0d2-806d6872ad2f,0a64441d-bddf-4992-996c-e7a186b4ac29,"https://www.wislawhelp.org/page/515/how-file-separation#:~:text=Like%20a%20divorce%2C%20a%20legal,same%20as%20in%20a%20divorce.",How to File for a Separation | Wisconsin Law Help,"Apr 8, 2025 — Like a divorce, a legal separation starts by filing a summons and complaint in the county court. Just like with a divor...",WisLawHelp.org,5,5,www.wislawhelp.org
81f1108d-9489-4392-b0d2-806d6872ad2f,62c32ce5-9ece-42b7-b610-a72363194771,"https://www.wicourts.gov/services/public/selfhelp/divorce.htm#:~:text=Wisconsin%20Court%20System%20%2D%20Court%20services,public%20%2D%20Self%2Dhelp%20law%20center",Self-Help: Divorce and Family Law - Wisconsin Court System,"Jul 30, 2024 — Wisconsin Court System - Court services - For the public - Self-help law center.",Wisconsin Court System (.gov),6,6,www.wicourts.gov
81f1108d-9489-4392-b0d2-806d6872ad2f,9d4fe102-79a7-4245-aaaa-d8b2a85e3a22,https://www.sterlinglawyers.com/wisconsin/child-custody/custody-process/,"10 Steps to a Child Custody Case in Wisconsin | Sterling Lawyers, LLC","This isn’t legal advice. You may want to consult a lawyer about this question. To file for child custody in Wisconsin,","Sterling Lawyers, LLC",7,7,www.sterlinglawyers.com
dbf98d2b-3a27-4ce1-96f6-7c9d87a28a57,4cf43037-c4cf-40f0-9858-3b09459ae159,"https://www.cityofpinebluff-ar.gov/doing-business#:~:text=The%20license%20fee%20depends%20on%20the%20type,Must%20secure%20a%20permit%20before%20starting%20operations",Doing Business - City Of Pine Bluff,The license fee depends on the type of business or total employment. Some businesses require additional permits: * **Construction ...,"City Of Pine Bluff, AR (.gov)",1,1,www.cityofpinebluff-ar.gov
dbf98d2b-3a27-4ce1-96f6-7c9d87a28a57,c8dba3cc-f31b-44d9-88a3-d774480c3dfe,"https://www.jeffersoncountyar.gov/our-county/businesses/dba-doing-business-as-declarations#:~:text=To%20file%20a%20DBA%20(Doing%20Business%20As),money%20order%20or%20cashier's%20check%20for%20$31","DBA (Doing Business As) Declarations | Jefferson County, AR","To file a DBA (Doing Business As) declaration in Jefferson County, Arkansas, you can: * Complete the certificate form * Sign the f...","Jefferson County, AR (.gov)",2,2,www.jeffersoncountyar.gov
dbf98d2b-3a27-4ce1-96f6-7c9d87a28a57,20d4c717-44d3-4972-9cb3-5b6288eee406,"https://www.dfa.arkansas.gov/wp-content/uploads/Starting_a_New_Business_in_Arkansas_2020.pdf#:~:text=SALES%20AND%20USE%20TAX%20A%20completed%20application,to%20the%20address%20listed%20on%20the%20application.",Starting a New Business in Arkansas,SALES AND USE TAX A completed application for a sales tax permit and a fifty dollar ($50) non - refundable fee is required to regi...,Arkansas Department of Finance and Administration (.gov),3,3,www.dfa.arkansas.gov
dbf98d2b-3a27-4ce1-96f6-7c9d87a28a57,a7f3b65c-bafd-49b7-a194-5fa5e1abe7f8,"https://www.cityofpinebluff-ar.gov/plugins/show_image.php?id=84#:~:text=The%20inspection%20fee%20of%20$75,Ste.103",~~'~~Il - City Of Pine Bluff,The inspection fee of $75 must be paid before aniriitialfrispectionwill bescheduled. Ifproblemsidehtified. in the initial inspecti...,"City Of Pine Bluff, AR (.gov)",4,4,www.cityofpinebluff-ar.gov
dbf98d2b-3a27-4ce1-96f6-7c9d87a28a57,768b3fbc-0c64-495a-ab0a-ecbe08b9fc21,"https://www.harborcompliance.com/arkansas-business-license#:~:text=Submit%20your%20application%E2%80%94Complete%20the,tax%20liabilities%20during%20your%20application.",Arkansas Business License | www.harborcompliance.com,"Submit your application—Complete the application through ATAP, and pay the $50 fee electronically. Processing typically takes eigh...",Harbor Compliance,5,5,www.harborcompliance.com
dbf98d2b-3a27-4ce1-96f6-7c9d87a28a57,41970995-c691-4b41-93f3-ae2fdae09586,"https://www.businesslicenses.com/Licenses/AR/Jefferson/Pine-Bluff-0506955310/#:~:text=How%20Much%20Does%20It%20Cost,'","Business Licenses and Permits in Pine Bluff, AR","How Much Does It Cost to Get a Pine Bluff, Arkansas Business License? The cost of a Pine Bluff, Arkansas Business License is uniqu...","Business Licenses, LLC",6,6,www.businesslicenses.com
dbf98d2b-3a27-4ce1-96f6-7c9d87a28a57,63e86369-0ce9-44da-aa38-fc7ed489eb2e,"https://asbtdc.org/how-much-does-it-cost-to-start-an-llc-in-arkansas/#:~:text=If%20you%20have%20a%20CPA%20or%20attorney,sell%20alcohol%20*%20Restaurant%20and%20foodservice%20permits",How Much Does It Cost to Start an LLC in Arkansas?,"Jan 11, 2022 — If you have a CPA or attorney assist you, the cost will generally increase by a few hundred dollars. Other costs to co...",Arkansas Small Business and Technology Development Center,7,7,asbtdc.org
dbf98d2b-3a27-4ce1-96f6-7c9d87a28a57,282dc3da-d818-4977-bd73-94439988875b,"https://www.davosalestax.com/arkansas-sales-tax-info/#:~:text=Once%20you're%20registered%20via%20ATAP%2C%20this%20is,register%20for%20an%20Arkansas%20sales%20tax%20permit.","Arkansas Sales Tax: Rates, Rules \u0026 Due Dates | DAVO","Once you're registered via ATAP, this is where you'll file, pay, and manage all sales tax tasks moving forward. Visit ...",DAVO Sales Tax,8,8,www.davosalestax.com
88edb312-bb51-425b-9d73-f724524b6ff1,817f6bf4-bee8-4d00-9e1c-16721224fd3d,https://nces.ed.gov/globallocator/index.asp?search=1&State=IN&city=Lebanon&zipcode=46052&School=1&PrivSchool=1&miles=15#:~:text=Search%20For%20Schools%20and%20Colleges,Search For Schools and Colleges - Department of Education,Search For Schools and Colleges.,National Center for Education Statistics (NCES) (.gov),1,1,nces.ed.gov
88edb312-bb51-425b-9d73-f724524b6ff1,ee91728f-5e82-4153-9cee-4f99a9faabcc,"https://www.franklin.edu/colleges-near/indiana/lebanon#:~:text=Looking%20for%20information%20about%20the,learn%20more%20about%20the%20guide.","Colleges Near Lebanon, Indiana - Franklin University",Looking for information about the best colleges and universities serving Lebanon? Here's your guide to the top schools offering de...,Franklin University,2,2,www.franklin.edu
88edb312-bb51-425b-9d73-f724524b6ff1,eab377e3-c474-4358-8df2-002e46106b86,"https://en.wikipedia.org/wiki/List_of_colleges_and_universities_in_Indiana#:~:text=There%20are%20approximately%2060%20colleges,the%20university%20of%20the%20state.",List of colleges and universities in Indiana - Wikipedia,"There are approximately 60 colleges and universities of various types, not counting branch campuses, in the U.S. state of Indiana.",Wikipedia,3,3,en.wikipedia.org
88edb312-bb51-425b-9d73-f724524b6ff1,d2c2e420-ae06-4df2-9515-12fa6c81b181,"https://lifeinindy.com/neighborhoods/lebanon/#:~:text=Within%20the%20city%20limits%2C%20you'll%20find%20lively,Indianapolis%2C%20Lafayette%2C%20or%20the%20Indianapolis%20International%20Airport.",Lebanon,"Within the city limits, you'll find lively small businesses, residential areas, and a newly renovated downtown square where the Bo...",Life In Indy,4,4,lifeinindy.com
88edb312-bb51-425b-9d73-f724524b6ff1,e7745cb1-3624-4d33-bbc9-684d99cfc0a1,https://www.usnews.com/education/best-colleges/articles/how-many-universities-are-in-the-us-and-why-that-number-is-changing,A Guide to the Changing Number of U.S. Universities - USNews.com,"When it comes to determining how many colleges and universities are in the U.S., it's a number in flux. The short answ...",U.S. News \u0026 World Report,5,5,www.usnews.com
