retrieval_id,aio_sources_id,source_url,source_title,source_text,source_name,source_rank,rank,root_domain
3eebec9f-70c3-4d12-98f4-0b5afd1b7942,5ab64044-a43c-4e92-89bc-987a2f03dc50,"https://www.erieri.com/cost-of-living/united-states/oregon/coquille#:~:text=How%20expensive%20is%20it%20to,of%20Living%20in%20Other%20Locations","Cost of Living in Coquille, OR - ERI Economic Research Institute","Nov 6, 2025 — How expensive is it to live in Coquille? Based on our Coquille cost of living calculator, Coquille is 12% less expensiv...",ERI Economic Research Institute,1,1,www.erieri.com
3eebec9f-70c3-4d12-98f4-0b5afd1b7942,b8a31108-a764-4a62-8ff8-cddf44c36ce2,"https://www.salary.com/research/cost-of-living/coquille-or#:~:text=Coquille's%202025%20cost%20of%20living,a%203%25%20increase%20from%202024.","Cost of Living in Coquille, OR 2025 - Salary.com","Oct 26, 2025 — Coquille's 2025 cost of living is $2734 per month for singles and $6020 per month for families of four. Living costs i...",Salary.com,2,2,www.salary.com
3eebec9f-70c3-4d12-98f4-0b5afd1b7942,f9a45d57-d2a2-4e1b-b9b0-63fc639d65de,"https://www.apartments.com/rent-market-trends/coquille-or/#:~:text=What%20is%20the%20average%20rent,%25%20$1%2C001%20%2D%20$1%2C500/mo.","Average Rent in Coquille, OR - Apartments.com","What is the average rent in Coquille, OR? $802/month. Average Rent. 525 Sq Ft. Average Apartment Size. +0.7% Increase in the Last ...",Apartments.com,3,3,www.apartments.com
3eebec9f-70c3-4d12-98f4-0b5afd1b7942,da42890c-b080-4055-bcfd-31d5e1413a6e,"https://www.zillow.com/home-values/38011/coquille-or/#:~:text=The%20average%20home%20value%20in%20Coquille%2C%20Oregon,wide%20variety%20of%20geographies%20and%20housing%20types.","Coquille, OR Housing Market: 2025 Home Prices & Trends | Zillow","The average home value in Coquille, Oregon is $312,773, which is down 2.4% over the past year. Here are some other key takeaways a...",Zillow,4,4,www.zillow.com
3eebec9f-70c3-4d12-98f4-0b5afd1b7942,5566e9e0-ad32-4ea0-8213-c9f803c3a427,"https://www.realtor.com/realestateandhomes-search/Coquille_OR/overview#:~:text=Coquille%2C%20OR%20housing%20market,sold%20price%20was%20$374K.","Coquille, OR 2025 Housing Market | realtor.com®","Coquille, OR housing market. In September 2025, the median listing home price in Coquille, OR was $435K, trending up 20.8% year-ov...",Realtor.com,5,5,www.realtor.com
4fb5b563-1f18-47ec-bcda-858a37b66ef9,fc74daa2-df91-4e01-9057-4f266fd3a71b,"https://www.losangelesbaptist.org/ourbeliefs-1#:~:text=We%20believe%20Jesus%20Christ%20to%20be%20eternally%20God%20and%20to,20:1%2D6).",Our Beliefs - Los Angeles Baptist Church,We believe Jesus Christ to be eternally God and to possess all the attributes of Deity. We believe that the Lord Jesus Christ was ...,Los Angeles Baptist Church,1,1,www.losangelesbaptist.org
4fb5b563-1f18-47ec-bcda-858a37b66ef9,d4dc56c3-fc97-4187-97ca-36d5600dd30a,"https://www.cachurch.com/about#:~:text=Statement%20of%20Faith,and%20serve%20those%20in%20need.",About Us | Christian Assembly Church Los Angeles,"Statement of Faith. The sole basis for our belief is the Bible, which is uniquely God-inspired, infallible, and the final authorit...",Christian Assembly Church,2,2,www.cachurch.com
4fb5b563-1f18-47ec-bcda-858a37b66ef9,82d5486d-39da-454e-abe5-9454b7df1d71,"https://www.fccla.org/#:~:text=First%20Congregational%20Church%20of%20Los%20Angeles%20is,*%20Painting%20*%20Science%20*%20Religious%20texts",First Congregational Church of Los Angeles,"First Congregational Church of Los Angeles is the oldest Protestant church in the city. It's a progressive, open church that welco...",First Congregational Church of Los Angeles,3,3,www.fccla.org
4fb5b563-1f18-47ec-bcda-858a37b66ef9,2d546b64-5d04-410c-9e37-4ada8bf328da,"https://thewestsidechurch.com/about/our-beliefs#:~:text=We%20believe%20in%20and%20surrender,the%20seal%20of%20our%20salvation.&text=The%20culminating%20event%20of%20the,promise%20that%20was%20for%20everyone.&text=As%20disciples%20of%20Jesus%2C%20we,follow%20the%20example%20of%20Jesus.&text=As%20members%20of%20the%20body,grow%20to%20be%20like%20Jesus.",Our Beliefs - The Westside Church,We believe in and surrender our lives to the one God who made the heavens and earth and who breathed life into humanity. We worshi...,The Westside Church,4,4,thewestsidechurch.com
4fb5b563-1f18-47ec-bcda-858a37b66ef9,b74fc3cd-a7cc-4520-93dd-8eda51854665,"https://www.royalcitychurch.org/what-we-believe.html#:~:text=%E2%80%8BTHE%20SON%20OF%20GOD,We%20will%20exist%20eternally.",What We Believe - ROYAL CITY CHURCH,"​THE SON OF GOD. The Bible. We believe that the Bible is the Word of God and because it was inspired by God, it is the truth witho...",Royal City Church,5,5,www.royalcitychurch.org
4fb5b563-1f18-47ec-bcda-858a37b66ef9,de2e315d-4b68-432c-b0d3-9b68ba15feca,"https://www.ccla.church/about-us#:~:text=Christ%20Church%20Los%20Angeles'%20beliefs%20include:%20*,in%20Christ%20alone%2C%20according%20to%20the%20Scriptures",About Us | Christ Church Los Angeles,Christ Church Los Angeles' beliefs include: * **The gospel of Jesus Christ** The message of how God rescues us from sin and restor...,Christ Church Los Angeles,6,6,www.ccla.church
4fb5b563-1f18-47ec-bcda-858a37b66ef9,df4fbb7e-a7b6-4426-bd5c-c57d9f8799ca,"https://laredshield.salvationarmy.org/LARedShield/what-we-believe/#:~:text=We%20believe%20that%20we%20are,endless%20punishment%20of%20the%20wicked.",What We Believe - L.A. Red Shield,We believe that we are justified by grace through faith in our Lord Jesus Christ and that He that believeth hath the witness in Hi...,L.A. Red Shield,7,7,laredshield.salvationarmy.org
4fb5b563-1f18-47ec-bcda-858a37b66ef9,fcc355c7-8d4f-4311-9e15-63b8973cfe28,"https://www.lafirstumc.org/#:~:text=We%20Acknowledge%20the%20Native%20Indigenous,undeveloped%20property%20in%20South%20Park.&text=Your%20browser%20can't%20play%20this%20video.",Los Angeles First United Methodist Church,"We Acknowledge the Native Indigenous peoples of Los Angeles, their special relationship to Mother Earth, and their hospitality, in...",Los Angeles First United Methodist Church,8,8,www.lafirstumc.org
4fb5b563-1f18-47ec-bcda-858a37b66ef9,1b83c0ad-8b04-41e6-90d6-a445d5db9c1e,"https://www.thrivelachurch.com/what-we-believe#:~:text=The%20Lord%20Jesus%20Christ%2C%20the,as%20King%20on%20earth%20forever.",What We Believe - Thrive LA Church,"The Lord Jesus Christ, the eternal Son of God, became man, without ceasing to be God, having been conceived of the Holy Spirit. He...",Thrive LA Church,9,9,www.thrivelachurch.com
4fb5b563-1f18-47ec-bcda-858a37b66ef9,2e720159-50a1-440f-bdd6-26a1fe3db56e,"https://unionchurchla.org/who-we-are#:~:text=Union%20Church%20is%20a%20100,the%20ever%2Dchanging%20neighborhood%20downtown.",Who We Are - Union Church of Los Angeles,Union Church is a 100-year-old Christian church in the heart of Little Tokyo in Downtown Los Angeles. The church was formed in 191...,Union Church of Los Angeles,10,10,unionchurchla.org
4fb5b563-1f18-47ec-bcda-858a37b66ef9,defccf61-3768-4fb6-9cac-c05ed441c391,"https://www.churchinlosangeles.org/about/what-we-believe/#:~:text=Eternally%20Christ%20is%20the%20only,nature%20and%20the%20human%20nature.",What We Believe - The Church in Los Angeles,"Eternally Christ is the only begotten Son in the Godhead (John 1:1, 18). In time He became a genuine human being through incarnati...",The Church in Los Angeles,11,11,www.churchinlosangeles.org
4fb5b563-1f18-47ec-bcda-858a37b66ef9,697f7fb1-5ce7-4ebc-8424-053f8080891d,https://www.churchinlosangeles.org/#:~:text=The%20Church%20in%20Los%20Angeles%20%E2%80%93%20Loving%20Jesus%20Christ%20and%20serving%20our%20community,The Church in Los Angeles – Loving Jesus Christ and serving our ...,The Church in Los Angeles – Loving Jesus Christ and serving our community.,The Church in Los Angeles,12,12,www.churchinlosangeles.org
09792165-a2d8-41f1-808d-c06a0cd4bdf6,01ffac8b-0174-4b72-8ec1-c143d66cdc44,https://www.youtube.com/watch?v=6HayntqYcZE&t=133,Clayton: Nothing to see here guys... keep it moving please ...,you got to keep it under control that looks like a courthouse i guarantee you wow that is very Oh look at this wall ri...,YouTube,1,1,www.youtube.com
b7224ff6-22c5-4325-988a-cf8911a8e234,58c25fa4-5809-4ea4-8842-78e78e624cfa,"https://www.atlasobscura.com/things-to-do/dade-city-florida#:~:text=There%20are%20many%20unusual%20things%20to%20do,features%20aquariums%2C%20fishing%20ponds%2C%20and%20local%20taxidermy",Cool and Unusual Things to Do in Dade City - Atlas Obscura,"There are many unusual things to do in Dade City, Florida, including: * **Kumquat Growers** A central Florida farm that is the lar...",Atlas Obscura,1,1,www.atlasobscura.com
b7224ff6-22c5-4325-988a-cf8911a8e234,e9f9db90-776c-41d0-a679-a7bf508649ee,https://www.dadecityfl.com/your_community/about_our_city/index.php,About Our City,"Dade City was established in 1889 and has a population of 7,500 residents and 7 square miles. The city's local economy has histori...","City of Dade City, FL",2,2,www.dadecityfl.com
c969ae0b-ee27-41e6-8252-ab23b0750afc,16753b6c-e552-4064-a17c-58363009b56b,"https://www.plattecity.org/pview.aspx?id=17082&catid=0#:~:text=Melissa%20Bazert,Fax:%20816.858.5402",Licenses and Permits - Platte City MO,"Melissa Bazert. Human Resources. City Clerk. Platte City, Mo 64079. Phone: 816.858.3046. Fax: 816.858.5402.",City of Platte City,1,1,www.plattecity.org
c969ae0b-ee27-41e6-8252-ab23b0750afc,77475de2-8d88-4620-b23f-cb3e8a2b0127,"https://plattecitymo.municipalone.com/forms.aspx?fid=687#:~:text=Welcome%20to%20the%20City%20of,Type%20of%20Application%20*",Business License Application,Welcome to the City of Platte City! We are excited that you chose to join our growing community. Platte City provides high quality...,City of Platte City,2,2,plattecitymo.municipalone.com
c969ae0b-ee27-41e6-8252-ab23b0750afc,62e18ad9-08e7-4e64-92b1-98cac30e28da,"https://dor.mo.gov/register-business/#:~:text=The%20Missouri%20Department%20of%20Revenue,confirmation%20number%20for%20your%20records.",Online New Business Registration,"The Missouri Department of Revenue and the Department of Labor and Industrial Relations, Division of Employment Security, want to ...",Missouri Department of Revenue (.gov),3,3,dor.mo.gov
c969ae0b-ee27-41e6-8252-ab23b0750afc,d8c83de1-2172-4a48-acf4-b85366f0e5d7,"https://dor.mo.gov/faq/taxation/business/registration.html#:~:text=How%20do%20I%20obtain%20a,when%20the%20business%20is%20delinquent.",Business Tax Registration FAQs,"How do I obtain a sales/use tax, corporate income tax or employer withholding tax number? You can complete the online registration...",Missouri Department of Revenue (.gov),4,4,dor.mo.gov
c969ae0b-ee27-41e6-8252-ab23b0750afc,ded9c8f9-47d7-4a7e-9bb2-9d829f6c8033,"https://ecode360.com/28551552#:~:text=When%20any%20applicant%20for%20an,carried%20on%20at%20said%20address.","Platte City, MO Business Licenses — Regulations and Fees","When any applicant for an occupational license is engaged in one (1) or more occupations or businesses at the same address, such a...",ecode360.com,5,5,ecode360.com
c969ae0b-ee27-41e6-8252-ab23b0750afc,4ee0e29c-a984-4bd2-b94d-f13c04fc7a49,"https://plattecountycollector.com/merchants.php#:~:text=Call%20the%20Platte%20County%20Collector's,business%20license%20you%20may%20have.",Merchant License - Platte County Collector,"Merchant and Manufacturing License Information * Do I need a Platte County Merchant's License for my business? Yes, if you answer ...",Platte County Collector,6,6,plattecountycollector.com
c969ae0b-ee27-41e6-8252-ab23b0750afc,f07b49eb-c0fa-40f0-8b6e-9db99425ae5f,"https://plattecountycollector.com/merchants.php#:~:text=Call%20the%20Platte%20County%20Collector's,the%20application%20at%20this%20site.",Merchant License - Platte County Collector,Call the Platte County Collector's office at (816) 858-3356. We will be happy to answer your questions and send you an application...,Platte County Collector,7,7,plattecountycollector.com
c969ae0b-ee27-41e6-8252-ab23b0750afc,a4ca3173-0185-42e8-a584-b9b895d01d2d,"https://dor.mo.gov/register-business/#:~:text=You%20may%20be%20required%20to,any%20questions%2C%20please%20contact%20us.",Online New Business Registration,You may be required to obtain a Federal Employer Identification Number (FEIN). The FEIN is issued by the Internal Revenue Service ...,Missouri Department of Revenue (.gov),8,8,dor.mo.gov
c969ae0b-ee27-41e6-8252-ab23b0750afc,d3f378c4-0bf3-40f0-97d3-36fdca789f6a,"https://www.plattecountycollector.com/#:~:text=Contact%20Information,Office%20Hours",Platte County Collector,"Contact Information. Location \u0026 Mailing Address. Platte County Collector. Administration Building. 415 3rd St., Room 212. Platte C...",Platte County Collector,9,9,www.plattecountycollector.com
c969ae0b-ee27-41e6-8252-ab23b0750afc,f5b266a9-6ae5-41a4-8d67-a5d5f77ac604,"https://www.plattecity.org/pview.aspx?id=17091&catid=0#:~:text=Utilities%20Submit%20utility%20service%20application%20In%20person,must%20be%20completed%20within%2024%2Dhours%20of%20submission.",Utilities,"Utilities Submit utility service application In person at City Hall 224 Marshall Road, Platte City, MO 64079 Submit deposit - staf...",City of Platte City,10,10,www.plattecity.org
c969ae0b-ee27-41e6-8252-ab23b0750afc,92dd91fd-fffd-4b8b-9406-615ca8b67e80,"https://www.plattecity.org/pview.aspx?id=17082&catid=0#:~:text=Business%20License:%20All%20individuals%20and%20companies%20doing,City%20)%20must%20have%20a%20business%20license.",Licenses and Permits,Business License: All individuals and companies doing business in Platte City ( City of Platte City ) must have a business license...,City of Platte City,11,11,www.plattecity.org
c969ae0b-ee27-41e6-8252-ab23b0750afc,745587a0-40e3-46d8-a429-6882adb43ec8,"https://www.mapquest.com/us/kansas/shawnee-city-hall-8269120#:~:text=City%20Hall%20also%20includes%20the%20offices%20of,well%20as%20fireworks%20display%20and%20solicitor%20permits.","Shawnee City Hall, 11110 Johnson Dr, Shawnee, KS 66203, US","City Hall also includes the offices of the city clerk, mayor and manager. The city clerk s office issues alcohol, cereal malt beve...",MapQuest,12,12,www.mapquest.com
c969ae0b-ee27-41e6-8252-ab23b0750afc,d2881c17-c68f-474a-bd1e-f36cf705766d,"https://www.carrollcountymo.gov/collector-treasurer/#:~:text=If%20you%20come%20in%20our%20office%20to,plus%20any%20other%20local%20city%20licenses%20needed.",Collector-Treasurer – Carroll County Missouri Courthouse,If you come in our office to process your application please bring a copy of your State Retail License and No Tax Due Letter. Merc...,Carroll County Missouri Courthouse (.gov),13,13,www.carrollcountymo.gov
aa3a0c86-9b7f-4747-9304-a2008041dfc1,1083f7d5-b853-402f-a303-e689fcdedb02,"https://unitsstorage.com/detroit-mi/places-to-live-in-mount-clemens-mi/#:~:text=Mount%20Clemens%2C%20Michigan%2C%20is%20a,looking%20for%20a%20welcoming%20community.","The Best Places to Live in Mount Clemens, Michigan","Sep 14, 2025 — Mount Clemens, Michigan, is a city full of history, charm, and community spirit. Known for its beautiful streets, hist...",UNITS Moving & Portable Storage,1,1,unitsstorage.com
aa3a0c86-9b7f-4747-9304-a2008041dfc1,0dba9557-6215-401d-921e-d0a29539c5c0,"https://visitdetroit.com/inside-the-d/first-timers-72-hour-guide-to-detroit/#:~:text=Three%20days%20is%20enough%20time,plenty%20more%20things%20to%20see.",First Timers 72 Hour Guide to Detroit,"Three days is enough time to give you a taste of Detroit, and experience the highlight reel. But chances are, after 72 hours in De...",Visit Detroit,2,2,visitdetroit.com
aa3a0c86-9b7f-4747-9304-a2008041dfc1,f56919b9-cf96-4782-b84c-70c8ea3037f4,"https://mountclemens.gov/history/#:~:text=The%20founder%20of%20our%20City,some%20property%20along%20the%20river.",Local History - City of Mount Clemens,"The founder of our City, Christian Clemens, first came to this area in 1796 as part of a surveying venture. At the time the area w...",City of Mount Clemens (.gov),3,3,mountclemens.gov
aa3a0c86-9b7f-4747-9304-a2008041dfc1,b0539a2d-9811-4446-a7b4-03ef06fbcc89,https://www.viator.com/Michigan/d22219,THE BEST 15 Things To Do in Michigan (UPDATED 2026) - Viator,"All the lakes, little and great * #1. 4.0. (6) Detroit Institute of Arts. ... * #2. 5.0. (2) Pictured Rocks National Lakeshore. ..",Viator,4,4,www.viator.com
aa3a0c86-9b7f-4747-9304-a2008041dfc1,d9eecd22-7539-4ddc-a9d3-3f2885add508,"https://letsdetroit.com/community/mount-clemens/#:~:text=Mount%20Clemens%2C%20Michigan%2C%20is%20a%20small%20town,looking%20for%20a%20place%20to%20call%20home.",Mount Clemens,"Mount Clemens, Michigan, is a small town in Macomb County with a unique blend of affordability, diversity, and job opportunities t...",Let's Detroit,5,5,letsdetroit.com
aa3a0c86-9b7f-4747-9304-a2008041dfc1,628c5d64-ce62-4b1a-8390-c194b137a533,"https://www.metroparent.com/things-to-do/guides/mount-clemens-with-kids/#:~:text=Located%20in%20the%20heart%20of%20downtown%20Mount,including%20ceramics%2C%20jewelry%20and%20clay%20making%20classes.",Best Things to Do with Kids in Mount Clemens,"Located in the heart of downtown Mount Clemens, the Anton Art Center is a cultural beacon offering a variety of art exh...",Metro Parent,6,6,www.metroparent.com
55a3dbde-6425-4ebd-b81f-8991ea325316,a810521f-8054-4e60-a77c-10c558af6552,"https://www.cta.org/educator/posts/organizing-to-fight-school-closures#:~:text=Communities%20are%20under%20attack%20across,inadequate%20funding%20from%20the%20state.",Organizing to Fight School Closures - California Teachers Association,"Mar 14, 2025 — Communities are under attack across California as school districts consider closing schools to “solve” budget problems...",California Teachers Association,1,1,www.cta.org
55a3dbde-6425-4ebd-b81f-8991ea325316,060fd39d-121d-40f6-bbda-159e1f7b7f8b,https://santaanachamber.com/list/member/santa-ana-unified-school-district-646#:~:text=Santa%20Ana%20Unified%20School%20District.,Santa Ana Unified School District,Santa Ana Unified School District.,Santa Ana Chamber of Commerce,2,2,santaanachamber.com
55a3dbde-6425-4ebd-b81f-8991ea325316,e90e4704-dbeb-40b8-8880-073023bcafea,"https://www.thetravel.com/when-is-spring-break-in-california/#:~:text=What%20month%20is%20spring%20break,to%20the%20beginning%20of%20May.",This Is When California Is Celebrating Spring Break - TheTravel,"Jan 21, 2025 — What month is spring break in California? Mostly the end of March to the beginning of May.",TheTravel,3,3,www.thetravel.com
55a3dbde-6425-4ebd-b81f-8991ea325316,e743c530-35a4-4905-a876-a96f958b3a37,https://support.google.com/websearch/answer/13687874,Google Weather,This response uses data provided by Google Weather,Google,4,4,support.google.com
55a3dbde-6425-4ebd-b81f-8991ea325316,98e4183a-201e-45ed-8036-95d51834ec24,"https://www.mapquest.com/us/california/santa-ana-unified-school-district-11472813#:~:text=Santa%20Ana%20Unified%20School%20District%20is%20a,high%2Dquality%20education%20to%20its%20diverse%20student%20population.","Santa Ana Unified School District, 1629 S Center St, Santa Ana, CA 92704, US","Santa Ana Unified School District is a comprehensive public school district located in Santa Ana, CA. With a wide range of educati...",MapQuest,5,5,www.mapquest.com
0b7e23a1-2b67-49c1-a2ea-df987519cd7b,56901b32-5b28-497b-844f-8ca94b9f6ec3,"https://www.wcnc.com/closings#:~:text=Submit%20a%20Closing/Delay,No%20delays%20or%20closings.",School and Business Closings and Delays | wcnc.com,School and Business Closings and Delays. ... No delays or closings.,WCNC,1,1,www.wcnc.com
0b7e23a1-2b67-49c1-a2ea-df987519cd7b,7d038d3b-a327-4151-9c0e-4bf70c2cc567,https://www.wcnc.com/closings#:~:text=No%20delays%20or%20closings.,School and Business Closings and Delays | wcnc.com,School and Business Closings and Delays. ... No delays or closings.,WCNC,2,2,www.wcnc.com
0b7e23a1-2b67-49c1-a2ea-df987519cd7b,799c9e90-2852-4421-afc5-1f01db7204f0,"https://www.gaston.k12.nc.us/calendar-page#:~:text=Upcoming%20Important%20Events,Read%20More%20about%20Holidays%20(Winter)",District Calendar - Gaston County Schools,Upcoming Important Events. Calendar RSS Feeds. Dec 19 2025. End of Second 9-Week Grading Period. all day. Read More about End of S...,Gaston County Schools,3,3,www.gaston.k12.nc.us
0b7e23a1-2b67-49c1-a2ea-df987519cd7b,89d7ce37-49d3-4352-a2d7-2209c028f1c0,https://www.gaston.k12.nc.us/,Gaston County Schools: Home,"Announcements * Holiday Break Information. The holiday break begins on Monday, December 22. Students return to class on Tuesday, J...",Gaston County Schools,4,4,www.gaston.k12.nc.us
0b7e23a1-2b67-49c1-a2ea-df987519cd7b,6bf39f3c-a7b0-4095-b6dd-c6ba6ac72c74,"https://www.facebook.com/GastonCountySchools/#:~:text=The%20holiday%20break%20begins%20Monday,and%20a%20happy%20New%20Year.",Gaston County Schools (@GastonCountySchools) • Facebook,"The holiday break begins Monday, Dec. 22, giving students and staff time to rest, recharge and enjoy time with family and friends.",Facebook,5,5,www.facebook.com
0b7e23a1-2b67-49c1-a2ea-df987519cd7b,e009ce56-9755-4730-95da-6d3751ca70e1,https://abc11.com/community/schoolclosings/#:~:text=No%20Closings%20at%20this%20time.,School Closings and Delays - ABC11 Raleigh-Durham,"Dec 10, 2025 — School Closings. ... No Closings at this time. ... Federal marijuana changes: What does this mean for NC?",ABC11,6,6,abc11.com
0b7e23a1-2b67-49c1-a2ea-df987519cd7b,d96c0833-b132-40b9-9f6f-7a4ef6ef38a2,https://www.hhclearningcenter.com/about1,School Closings and Delays... | hhclc,"SCHOOL'S CLOSINGS AND DELAYS... Check here for up-to-the-minute Helping Hand's school closings or delays in your area, in the even...",www.hhclearningcenter.com,7,7,www.hhclearningcenter.com
0b7e23a1-2b67-49c1-a2ea-df987519cd7b,5ead5281-d905-4aa6-9b1f-e5c12da31eea,"https://www.gaston.k12.nc.us/for-parents/inclement-weather-policy#:~:text=During%20extremely%20bad%20weather%2C%20it,follow%20us%20on%20Twitter:%20@GastonSchools",Inclement Weather Policy - Gaston County Schools,"During extremely bad weather, it sometimes becomes necessary for a decision to be made concerning the closing of schools. When a d...",Gaston County Schools,8,8,www.gaston.k12.nc.us
fd59c614-4830-47ec-901f-3af2fd7c068e,57b86dfb-3090-4e0c-912a-0c61a14fcd3c,https://www.reddit.com/r/Littleton/comments/1piinq4/movingneighborhood_safety_question/,moving/neighborhood safety question : r/Littleton - Reddit,"Dec 8, 2025 — Comments Section * Electrical_Kale_2239. • 7d ago. Wonderful area. Very safe. Use common sense like locking doors. * ap...",Reddit,1,1,www.reddit.com
fd59c614-4830-47ec-901f-3af2fd7c068e,d1888c1a-18ee-48c2-b3db-c43c42b1d1ee,"https://www.apartments.com/local-guide/downtown-littleton-littleton-co/#:~:text=Downtown%20Littleton%20%2D%20Littleton%2C%20CO&text=Located%20in%20a%20family%2Dfriendly,upscale%20and%20affordable%20rental%20options.",Is Downtown Littleton a Good Place To Live in Littleton CO?,"Downtown Littleton - Littleton, CO ... Located in a family-friendly city with small-town charm, Downtown Littleton is Littleton's ...",Apartments.com,2,2,www.apartments.com
fd59c614-4830-47ec-901f-3af2fd7c068e,81e7b690-27ce-48cb-b516-fc2ed1a93977,"https://homegrownmoving.com/blog/moving-to-living-in-littleton-co/#:~:text=If%20you're%20curious%20about,very%20safe%20place%20to%20live.",Living in Littleton CO Complete Guide | Everything to Know ...,"Sep 1, 2025 — If you're curious about moving to the area, you might wonder, is Littleton CO safe? The answer is a resounding yes! Lit...",Homegrown Moving and Storage,3,3,homegrownmoving.com
fd59c614-4830-47ec-901f-3af2fd7c068e,d273547b-ec9e-4db0-8e52-6f0accd06058,"https://www.doorprofit.com/crime-map/city/littleton-CO/neighborhood/downtown-littleton/#:~:text=About%20Downtown%20Littleton,suspicious%20activity%20to%20local%20authorities",Downtown Littleton Crime Map - DoorProfit,"About Downtown Littleton. With a crime score of A-, this area has very low crime compared to other neighborhoods in the city. Safe...",DoorProfit,4,4,www.doorprofit.com
fd59c614-4830-47ec-901f-3af2fd7c068e,b28078b3-032c-4f96-bd60-fd0a000eeb58,"https://nextdoor.com/resources/crime-and-safety/littleton--co/#:~:text=In%20Littleton%2C%20CO%2C%20the%20overall,a%20safe%20place%20to%20live.","Littleton, CO crime rates and safety statistics - Nextdoor","In Littleton, CO, the overall crime rate is slightly higher than the national average, with a rate of 34.59 compared to 33.37 per ...",Nextdoor,5,5,nextdoor.com
fd59c614-4830-47ec-901f-3af2fd7c068e,6f4479e2-00af-4442-95f5-9850c4b70347,"https://www.police.littletonco.gov/About-LPD/Crime-Maps#:~:text=The%20Littleton%20Police%20Department%20(LPD,map%20below%20provides%20several%20features:",Crime Maps - Littleton Police Department,The Littleton Police Department (LPD) strives to keep the public informed about crime in Littleton. Using data from LPD's Record M...,Littleton Police Department (.gov),6,6,www.police.littletonco.gov
fd59c614-4830-47ec-901f-3af2fd7c068e,d82db864-828d-4d7d-a7aa-81f26515a2b4,"https://www.extraspace.com/blog/city-guides/things-to-know-about-living-in-littleton-co/#:~:text=A%20Safe%2C%20Family%2DFriendly%20Community,-Photo%20via%20@seaquestlittleton&text=Littleton%20is%20one%20of%20the,splash%2C%20swim%2C%20and%20slide.",Moving to Littleton? Here Are 13 Things to Know - Extra Space Storage,"Nov 20, 2025 — A Safe, Family-Friendly Community ... Littleton is one of the best places to live in Colorado and a great place to rai...",Extra Space Storage,7,7,www.extraspace.com
fd59c614-4830-47ec-901f-3af2fd7c068e,44b2c1dd-39ad-4e57-a68f-95cfcf0a2f80,"https://www.police.littletonco.gov/Home#:~:text=Mission%20Statement,Patrol%20and%20Investigations/Support%20Services.",Home Littleton Police Department,"Dec 15, 2025 — Mission Statement. The Littleton Police Department mission is to catch criminals and prevent crime, to comfort victims...",Littleton Police Department (.gov),8,8,www.police.littletonco.gov
